timestamp,subreddit,title,score,url,id,keyword_matched
2025-12-08T17:17:09.931619,worldnews,"Over 16,000 Civilians Killed in Ukraine Due to Russian Shelling, Death Toll Rises by 2,600 in One Year",1197,https://united24media.com/latest-news/over-16000-civilians-killed-in-ukraine-due-to-russian-shelling-death-toll-rises-by-2600-in-one-year-13829,t3_1p87ekz,AI
2025-12-08T17:17:09.931619,worldnews,Putin doubles down on demands for Ukrainian territory ahead of talks with US,596,https://www.bbc.com/news/articles/cp84nl57v0lo,t3_1p87cld,AI
2025-12-08T17:17:09.931619,worldnews,Putin ready for 'serious' peace talks and says U.S.-Ukraine draft could be basis for a deal,0,https://www.nbcnews.com/world/russia/putin-russia-ready-serious-talks-trump-peace-plan-ukraine-war-rcna246205,t3_1p86g2e,AI
2025-12-08T17:17:09.931619,worldnews,"Japan will pay 'painful price' if steps out of line over Taiwan, China military says",1031,https://www.reuters.com/world/china/japan-will-pay-painful-price-if-steps-out-line-over-taiwan-china-says-2025-11-27/,t3_1p85sy9,AI
2025-12-08T17:17:12.120700,worldnews,Venezuela revokes flight rights for six airlines amid escalating US tensions,224,https://www.reuters.com/world/americas/venezuela-revokes-flight-rights-six-airlines-amid-escalating-us-tensions-2025-11-27,t3_1p82krk,AI
2025-12-08T17:17:12.121694,worldnews,Swiss lawsuit against gold bar US trade delegation,71,https://www.swissinfo.ch/eng/global-trade/swiss-lawsuit-against-gold-bar-us-trade-delegation/90520895,t3_1p829qg,AI
2025-12-08T17:17:12.121694,worldnews,Bangladesh Hands Ex-Leader 21 Years in Jail After Death Penalty,82,https://www.bloomberg.com/news/articles/2025-11-27/bangladesh-hands-ex-leader-21-years-in-jail-after-death-penalty,t3_1p7yy2d,AI
2025-12-08T17:17:12.121694,worldnews,Allies worry US demands Ukraine deal before security guarantees,120,https://www.politico.com/news/2025/11/26/us-demands-peace-deal-before-security-guarantees-for-ukraine-00670210,t3_1p7ws4l,AI
2025-12-08T17:17:12.121694,worldnews,"Peace deal should limit Russia's army rather than Ukraine's, says Kaja Kallas",20584,https://www.euronews.com/my-europe/2025/11/26/peace-deal-should-limit-russias-army-rather-than-ukraines-says-kaja-kallas,t3_1p7w39k,AI
2025-12-08T17:17:12.121694,worldnews,"EU: Kallas Calls for Immediate, Unconditional Ceasefire and Reparations Loan to Ukraine Backed by Frozen Russian Assets",2393,https://www.kyivpost.com/post/65059,t3_1p7tutj,AI
2025-12-08T17:17:14.302235,worldnews,"/r/WorldNews Live Thread: Russian Invasion of Ukraine Day 1372, Part 1 (Thread #1519)",576,https://www.reddit.com/live/18hnzysb1elcs,t3_1p7sgio,AI
2025-12-08T17:17:14.302235,worldnews,"KNU raid on DKBA-controlled area uncovers 2,000 scam workers, 733 foreign nationals arrested",74,https://eng.mizzima.com/2025/11/26/28537,t3_1p7pv86,AI
2025-12-08T17:17:14.302235,worldnews,"Trump told Japan's PM in their call to lower the tone on Taiwan, WSJ reports",3403,https://www.reuters.com/world/china/trump-told-japans-pm-lower-tone-taiwan-wsj-reports-2025-11-26/,t3_1p7oyyk,AI
2025-12-08T17:17:14.302235,worldnews,Study claims to provide first direct evidence of dark matter,452,http://theguardian.com/science/2025/nov/25/study-claims-to-provide-first-direct-evidence-of-dark-matter,t3_1p7n772,AI
2025-12-08T17:17:14.302235,worldnews,"Russian Red Cross Linked to Child Soldiers and Occupation in Ukraine, Investigation Reveals",1453,https://united24media.com/latest-news/russian-red-cross-linked-to-child-soldiers-and-occupation-in-ukraine-investigation-reveals-13803,t3_1p7lcrb,AI
2025-12-08T17:17:14.302235,worldnews,UK police to trial AI agents responding to non-emergency calls,31,https://www.bbc.com/news/articles/cvgq03y0l3yo,t3_1p7l8hl,AI
2025-12-08T17:17:14.302235,worldnews,Russian military reportedly executes 5 Ukrainian POWs,8873,https://kyivindependent.com/russian-military-reportedly-executes-5-ukrainian-pows/,t3_1p7jowz,AI
2025-12-08T17:17:14.302235,worldnews,India Gate air pollution protest: Six protesters sent to three-day police custody,1,https://timesofindia.indiatimes.com/india/india-gate-protest-six-protesters-send-to-three-day-police-custody/articleshow/125595763.cms,t3_1p7g6az,AI
2025-12-08T17:17:14.302235,worldnews,Japan scrambles jets after suspected Chinese drone spotted near Taiwan,2729,https://www.abc.net.au/news/2025-11-25/japan-scrambles-jets-after-suspected-chinese-drone-taiwan/106052948,t3_1p7fcin,AI
2025-12-08T17:17:14.302235,worldnews,Panama lawmakers arrive in Taiwan despite reported China pressure,74,https://focustaiwan.tw/politics/202511250018,t3_1p7dvvn,AI
2025-12-08T17:17:17.203934,worldnews,Taiwan puts $40 billion toward buying US weapons and building a defense dome,883,https://apnews.com/article/taiwan-defense-budget-arms-purchases-spending-c1f34ad69a12b9599f4a356abd3b31c4,t3_1p7clau,AI
2025-12-08T17:17:17.203934,worldnews,Guinea-Bissau military officers claim 'total control' of country,61,https://www.france24.com/en/africa/20251126-gunfire-heard-near-guinea-bissau-presidential-palace-provisional-election-results-expected?utm_slink=go.france24.com%2FphI,t3_1p7auau,AI
2025-12-08T17:17:17.203934,worldnews,Colombian president says oil is ‘at the heart of’ US pressure campaign on Venezuela,8918,https://www.cnn.com/2025/11/26/americas/colombia-petro-venezuela-oil-us-latam-intl,t3_1p79cjx,AI
2025-12-08T17:17:17.203934,worldnews,"Drones strike Russia’s Cheboksary, military claims military electronics factory hit",194,https://kyivindependent.com/drones-strike-russias-cheboksary-reports-say-electronic-warfare-plant-hit-again/,t3_1p793ex,AI
2025-12-08T17:17:17.203934,worldnews,German Chancellor Merz: The West Won’t Let Putin Dictate Ukraine’s Future,3588,https://united24media.com/latest-news/german-chancellor-merz-the-west-wont-let-putin-dictate-ukraines-future-13788,t3_1p78bft,AI
2025-12-08T17:17:17.203934,worldnews,Senior Putin aide says US-Russian peace plan for Ukraine could have been negotiated over WhatsApp,619,https://novayagazeta.eu/articles/2025/11/26/senior-putin-aide-says-us-russian-peace-plan-for-ukraine-could-have-been-negotiated-over-whatsapp-en-news,t3_1p77vv1,AI
2025-12-08T17:17:17.203934,worldnews,Top French court upholds Sarkozy's conviction of illegal campaign financing in 2012 election,94,https://www.lemonde.fr/en/france/article/2025/11/26/top-court-upholds-sarkozy-s-conviction-over-campaign-overspending_6747843_8.html,t3_1p77mxg,AI
2025-12-08T17:17:17.203934,worldnews,China team simulates large-scale electronic warfare against Musk’s Starlink,6326,https://www.scmp.com/news/china/science/article/3333523/chinese-researchers-simulate-large-scale-electronic-warfare-against-elon-musks-starlink,t3_1p75ymg,AI
2025-12-08T17:17:17.203934,worldnews,U.S. Army secretary warned Ukraine of imminent defeat while pushing initial peace plan,1621,https://www.nbcnews.com/politics/white-house/us-army-secretary-warned-ukraine-imminent-defeat-pushing-initial-peace-rcna245704,t3_1p75avz,AI
2025-12-08T17:17:17.203934,worldnews,"Taiwan to prepare for combat by 2027, president says - as he warns China is preparing to take the country by force",12827,https://news.sky.com/story/taiwan-to-prepare-for-combat-by-2027-president-says-as-he-warns-china-is-preparing-to-take-the-country-by-force-13475504,t3_1p73lhx,AI
2025-12-08T17:17:19.812508,worldnews,"Russia Says US Envoy Witkoff to Visit Moscow Next Week ┃ The flurry of diplomatic activity underscores the White House’s optimism around Ukraine negotiations, but doubts remain in European capitals",338,https://www.bloomberg.com/news/articles/2025-11-26/russia-says-us-envoy-witkoff-to-visit-moscow-next-week,t3_1p72n0p,AI
2025-12-08T17:17:19.812508,worldnews,"Taiwan's President Lai lashes out against Beijing, pledges $40 billion in additional defense budget",528,https://www.cnbc.com/2025/11/26/taiwan-president-lai-china-japan-xi-trump-defense.html,t3_1p72eie,AI
2025-12-08T17:17:19.812508,worldnews,"Citing 'peace through strength,' Lai pushes US$40 billion defense budget - Focus Taiwan",59,https://focustaiwan.tw/politics/202511260006,t3_1p728av,AI
2025-12-08T17:17:19.812508,worldnews,US Army secretary warns Ukraine of impending defeat,0,https://newsukraine.rbc.ua/news/us-army-secretary-warns-ukraine-of-impending-1764139522.html,t3_1p71bqq,AI
2025-12-08T17:17:19.812508,worldnews,"Trump on leaked Witkoff-Russia call: He has to ""sell Ukraine to Russia"", it's deal-maker's job",19678,https://www.pravda.com.ua/eng/news/2025/11/26/8009009/,t3_1p70ohp,AI
2025-12-08T17:17:19.812508,worldnews,"/r/WorldNews Live Thread: Russian Invasion of Ukraine Day 1371, Part 1 (Thread #1518)",563,https://www.reddit.com/live/18hnzysb1elcs,t3_1p6xw9c,AI
2025-12-08T17:17:19.812508,worldnews,Malaysia’s PM defends Thailand-Cambodia mediator role amid meddling complaints,21,https://www.scmp.com/week-asia/politics/article/3334135/malaysias-anwar-aims-mediate-thailand-cambodia-row-protests-over-his-role-mount?module=top_story&pgtype=homepage,t3_1p6xhed,AI
2025-12-08T17:17:19.812508,worldnews,Taiwan president says he will propose extra $40 billion in defence spending,144,https://www.reuters.com/world/china/taiwan-president-says-he-will-propose-extra-40-billion-defence-spending-2025-11-25/,t3_1p6wxus,AI
2025-12-08T17:17:19.812508,worldnews,Putin says authorities must galvanise Russian identity in Ukraine,0,https://www.reuters.com/world/europe/putin-says-authorities-must-galvanise-russian-identity-ukraine-2025-11-26/,t3_1p6w5zy,AI
2025-12-08T17:17:19.828499,worldnews,"Russian General In Venezuela Leading Advisory Mission: Ukraine's Intel Chief. This isn’t about drugs. Russia, and china on US doorstep.",498,https://www.twz.com/news-features/russian-general-in-venezuela-leading-advisory-mission-ukraines-intel-chief,t3_1p6v7k6,AI
2025-12-08T17:17:19.828499,worldnews,Jacob Zuma’s daughter accused of tricking men into fighting for Russia in Ukraine,146,https://www.theguardian.com/world/2025/nov/25/jacob-zuma-daughter-accused-tricking-men-fighting-for-russia-in-ukraine,t3_1p6unca,AI
2025-12-08T17:17:22.431434,worldnews,US to send envoy to Moscow to discuss proposals to end Ukraine war,168,https://www.theguardian.com/world/2025/nov/25/us-kyiv-and-moscow-officials-continue-talks-on-trump-plan-to-end-ukraine-war,t3_1p6s8hg,AI
2025-12-08T17:17:22.431434,worldnews,Four more detained in Louvre heist as fate of jewels remains unknown,36,https://www.washingtonpost.com/world/2025/11/25/louvre-heist-detentions/,t3_1p6q2gx,AI
2025-12-08T17:17:22.432431,worldnews,Chinese airlines cancel flights on 12 Japan routes as tensions continue to rise,3816,https://amp.scmp.com/economy/china-economy/article/3333975/chinese-airlines-cancel-flights-12-japan-routes-tensions-continue-rise,t3_1p6p88l,AI
2025-12-08T17:17:22.432431,worldnews,"EU Parliament calls for sanctions against Orbán: Hungary has turned into ""electoral autocracy""",1466,https://www.eunews.it/en/2025/11/25/eu-parliament-calls-for-sanctions-against-orban-hungary-has-turned-into-electoral-autocracy/,t3_1p6p4ga,AI
2025-12-08T17:17:22.432431,worldnews,Venezuela demands international airlines resume flights,96,https://www.bbc.com/news/articles/cg4nl3dxkd9o,t3_1p6ozgb,AI
2025-12-08T17:17:22.432431,worldnews,"As potential Ukraine deal looms, France and Britain map out boots-on-ground role",65,https://www.politico.eu/article/potential-deal-looms-france-and-britain-map-out-role-ukraine/,t3_1p6ordr,AI
2025-12-08T17:17:22.432431,worldnews,"Zelenskyy Says Ukraine Prepared to Advance With US, Trump, and European Leaders on Future Security Framework",134,https://united24media.com/latest-news/zelenskyy-says-ukraine-prepared-to-advance-with-us-trump-and-european-leaders-on-future-security-framework-13771,t3_1p6o1pb,AI
2025-12-08T17:17:22.432431,worldnews,Witkoff Advised Russia on How to Pitch Ukraine Plan to Trump,4128,https://www.bloomberg.com/news/articles/2025-11-25/witkoff-advised-russia-on-how-to-pitch-ukraine-plan-to-trump,t3_1p6mwme,AI
2025-12-08T17:17:24.770576,worldnews,Jair Bolsonaro ordered to start 27-year prison term for plotting Brazil coup,23076,https://www.theguardian.com/world/2025/nov/25/jair-bolsonaro-brazil-prison,t3_1p6kvlr,AI
2025-12-08T17:17:24.770576,worldnews,"Facing a lack of Russian recruits, Moscow is accused of using deception and bribery to sign up foreigners to fight in Ukraine",545,https://www.cnn.com/2025/11/25/europe/russia-recruits-foreign-fighters-ukraine-intl-cmd,t3_1p6j88u,AI
2025-12-08T17:17:24.770576,worldnews,"Big Ukraine Drone+Missile Strike Operation Torches Russian ‘AWACS,’ Oil Refineries",979,https://www.kyivpost.com/post/64965,t3_1p6iv05,AI
2025-12-08T17:17:24.770576,worldnews,Ukraine-Russia war: Ukraine calls for Trump-Zelensky meeting in US this week,137,https://www.bbc.com/news/articles/cy95jvw57v2o,t3_1p6hd3e,AI
2025-12-08T17:17:24.770576,worldnews,"Japan on track to deploy missiles to island near Taiwan, Koizumi says",148,https://www.japantimes.co.jp/news/2025/11/23/japan/japan-deploying-missiles-to-island-near-taiwan/,t3_1p6gsqp,AI
2025-12-08T17:17:24.770576,worldnews,"US Army secretary holds talks with Russians in UAE, Ukraine's Defence Intelligence head also present",480,https://www.pravda.com.ua/eng/news/2025/11/25/8008939/,t3_1p6f7o9,AI
2025-12-08T17:17:24.770576,worldnews,"European Parliament to announce its position on ""peace plan"" for Ukraine on 27 November",53,https://www.pravda.com.ua/eng/news/2025/11/25/8008916/,t3_1p6emff,AI
2025-12-08T17:17:24.770576,worldnews,"Vatican warns against rise in polyamory, saying ‘succession of faces’ does not rival exclusive union",1838,https://www.cnn.com/2025/11/25/world/vatican-warning-rise-polyamory-monogamy-intl,t3_1p6ejj1,AI
2025-12-08T17:17:24.770576,worldnews,"We never recognised Arunachal Pradesh, says China after detaining Indian woman for 18 hours",139,https://www.firstpost.com/world/we-never-recognised-arunachal-pradesh-says-china-after-detaining-indian-woman-for-18-hours-13953983.html,t3_1p6djmr,AI
2025-12-08T17:17:24.770576,worldnews,Ukrainian drones target Russian military aircraft manufacturer in reported strikes,652,https://kyivindependent.com/ukrainian-drones-target-russian-military-aircraft-manufacturer-in-reported-strikes/,t3_1p6d72g,AI
2025-12-08T17:17:26.761953,worldnews,"Russia weighs how to prop up Russian Railways which is $51 billion in debt, sources say",4335,https://www.reuters.com/sustainability/boards-policy-regulation/russia-weighs-how-prop-up-russian-railways-which-is-51-billion-debt-sources-2025-11-25/,t3_1p6csew,AI
2025-12-08T17:17:26.761953,worldnews,"Nine children killed in Pakistani airstrikes in Afghanistan, Taliban says",91,https://www.nbcnews.com/world/asia/nine-children-killed-pakistani-airstrikes-afghanistan-taliban-says-rcna245799,t3_1p6c1bz,AI
2025-12-08T17:17:26.761953,worldnews,"Macron Rejects Trump’s Peace Plan as Is, Backs Assurance Forces for Ukraine",5130,https://united24media.com/latest-news/macron-rejects-trumps-peace-plan-as-is-backs-assurance-forces-for-ukraine-13752,t3_1p6b81f,AI
2025-12-08T17:17:26.761953,worldnews,"Ukraine agrees to peace proposal, with only ""minor details"" to settle, official says, but no word from Russia",82,https://www.cbsnews.com/news/ukraine-russia-war-peace-deal-trump-driscoll-abu-dhabi-talks-latest,t3_1p6b7sa,AI
2025-12-08T17:17:26.761953,worldnews,"Afghanistan says 9 children killed in Pakistani air strikes, vows to respond",78,https://www.reuters.com/world/asia-pacific/nine-children-killed-pakistani-bomb-attack-afghan-province-taliban-spokesperson-2025-11-25/,t3_1p6as7d,AI
2025-12-08T17:17:26.761953,worldnews,Russia’s drones violated the airspace of Moldova and Romania — one fell straight onto a civilian roof (MAP),1692,https://euromaidanpress.com/2025/11/25/russias-drones-violated-the-airspace-of-moldova-and-romania-one-fell-straight-onto-a-civilian-roof-map/,t3_1p6a6h8,AI
2025-12-08T17:17:26.761953,worldnews,Chio La Cuptor! Coapte nu prajite! Cu 70% mai putine grasimi,0,https://alb.reddit.com/cr?za=BJ0LQShwVX2jCg_O47eUu-p3QFwdl4wE11kj3CRvNQAyxf0lb_kTvZKOmMwMYVaTpZ0LFA7xKaxeRuWj9uhQLT7P4wbVs9Rp47VNdCHobjhjM3TUj0Zyyr7OTqPEZ_KiBo_BlRbP4sZAR1jQsfxEtqVqBNAleMUSSA4J4e96N5RYkuA0taWbzvz6W3rmK3TVmzBK4Hmh_SD6Eyv7vWeek2Vrk7UsWMGeICIjBEJQJjOkoWrPkqNxE7ODmzClW4RCN-OrBpXBziCEFs8DVsd2vtaqxR5eKzkz9APXA0SPZdDUeRC_-fmD6NEmxzZjd1yAtkASaxd5aSBx4ekva_7s7Gc_EuK1PFb9qpJL5yPyMcPuDyTMdhSMVlA7WGzQ1LwqLXqy6AllHjWUnG586tApCn1iDWH6Ru12MVCexH_aex9tOFFdiMk_CMq3OmJsMNTYLDsBvpYGeKokpJ3-uk-Fd41hJIPjUgoOOJosvjUXCRc32kaYg5ev84vGnJgZFPvYxw1iHRYcXrwPIT0ufLdQTQBUrFenTt3-L-X2ZdMxqRCyUJv0Jsotc_C5cFJlBTHm0zVJyuahhqJqKg8yPu36rKF_avnxHKfifmZONWwzpMsoZnbx6tWhvZY&zp=knUmLj2mFLgnLp9kKJJLp8AUz1qEjADUEiAVdoapFAKH6doqY_0E3q0C_d5r3GoCAdoo9EGZKzT7K2zOLO79GUZve0Xz0icZ69EbwE5VollFV7tyGiEX7bgFqOYq5IXTBdqsBNDaGennAo76joH5K6iYyPz3rmue4b64ThfuRc4TnG5jHF1ulALEyAYiewemIEOvdZkxqkbnFGuFAwLlEJRyG9GStobneX-kMgmwlI29e0cDBzUjpJ7EruKSdrzgSHEeESSxTRo8suLVuSyqTMH1djUIotX9k2lcE2DW-IaH8B0TLd7IdZN6AnycTlgkaaWoMXO0-CViyoY1kZM9WQzBo_kPHQ1w6FRIypZcjOkuNBOffB-Io8pbr2BLYg2I2PoRLINJEKJzISfZhUxZpTRDBAoKOpRvTuWnW2F6ZURKB0Mq3-Qu_yKds7bSHZqeNRzfSpaFuV_pz-RBTWdW9m71LUPnb_dujEjB_2MI68oHQwGa,t3_1pe39zl,AI
2025-12-08T17:17:26.761953,worldnews,Former Reform in Wales leader Nathan Gill jailed for pro-Russian bribery,3273,https://www.bbc.co.uk/news/articles/c5yd878ejqko,t3_1p69p7v,AI
2025-12-08T17:17:26.761953,worldnews,Russia’s tiny advances in 2025 sold Putin on inevitable victory in Ukraine,501,https://www.washingtonpost.com/world/2025/11/25/russia-ukraine-war-offensive-2025/,t3_1p69p2w,AI
2025-12-08T17:17:26.761953,worldnews,Investigation underway into recent crash of U.S. Air Force MQ-9 Reaper drone,44,https://en.yna.co.kr/view/AEN20251125008800315,t3_1p695rx,AI
2025-12-08T17:17:26.762964,worldnews,US holds secret meetings with Russians in Abu Dhabi on Ukraine,3640,https://abcnews.go.com/Politics/us-holds-secret-meetings-russians-abu-dhabi-ukraine/story?id=127840867,t3_1p67u6r,AI
2025-12-08T17:17:26.762964,worldnews,Russian drones breach NATO airspace in long-range strikes,11061,https://www.newsweek.com/russian-drones-breach-nato-airspace-in-long-range-strikes-ukraine-romania-11103426,t3_1p66yf9,AI
2025-12-08T17:17:26.762964,worldnews,Romania scrambles fighter jets after drones breach its airspace,404,https://www.reuters.com/world/romania-scrambles-fighter-jets-after-drones-breach-its-airspace-2025-11-25/,t3_1p66ej6,AI
2025-12-08T17:17:26.762964,worldnews,"US ""cannot"" supply weapons to Ukraine indefinitely – White House press secretary",3124,https://www.pravda.com.ua/eng/news/2025/11/25/8008837,t3_1p65u8c,AI
2025-12-08T17:17:26.762964,worldnews,China’s Xi Jinping raises future of Taiwan in call with Donald Trump,317,https://www.theguardian.com/world/2025/nov/25/china-taiwan-xi-jinping-call-with-donald-trump,t3_1p64xhe,AI
2025-12-08T17:17:29.249697,worldnews,"/r/WorldNews Live Thread: Russian Invasion of Ukraine Day 1370, Part 1 (Thread #1517)",547,https://www.reddit.com/live/18hnzysb1elcs,t3_1p62oni,AI
2025-12-08T17:17:29.249697,worldnews,South Korea aims to strengthen commercial ties with Iran,69,https://news.az/news/south-korea-aims-to-strengthen-commercial-ties-with-iran,t3_1p62h9c,AI
2025-12-08T17:17:29.249697,worldnews,Japan sends letter to UN chief rebutting China's demand over Taiwan remarks,101,https://english.kyodonews.net/articles/-/65559,t3_1p623cq,AI
2025-12-08T17:17:29.251700,worldnews,Japan PM Takaichi holds call with Trump amid China dispute,116,https://www.reuters.com/world/china/japan-pm-takaichi-speak-with-donald-trump-by-phone-tuesday-fnn-says-2025-11-25/,t3_1p61f7w,AI
2025-12-08T17:17:29.251700,worldnews,‘Fake news’: French navy slams Pakistan media over misinformation on Operation Sindoor; calls Rafale claims fabricated - The Times of India,71,https://timesofindia.indiatimes.com/india/fake-news-french-navy-slams-pakistan-media-over-misinformation-on-operation-sindoor-calls-rafale-claims-fabricated/amp_articleshow/125518149.cms,t3_1p61cvd,AI
2025-12-08T17:17:29.251700,worldnews,‘It’s hell for us here’: Mumbai families suffer as datacentres keep the city hooked on coal,243,https://www.theguardian.com/technology/2025/nov/24/mumbai-datacentres-coal-air-pollution,t3_1p61a68,AI
2025-12-08T17:17:29.251700,worldnews,Russia Bombards Kyiv Hours After Trump Voices Hope for Ukraine Deal,1762,https://www.bloomberg.com/news/articles/2025-11-25/russia-bombards-kyiv-after-trump-voices-hope-for-deal-on-ukraine,t3_1p5zsia,AI
2025-12-08T17:17:29.251700,worldnews,Colombia raids hotel hosting Lev Tahor sect members,54,https://www.ctvnews.ca/montreal/article/colombia-raids-hotel-hosting-lev-tahor-sect-members-and-takes-17-children-into-protective-custody/,t3_1p5wcfe,AI
2025-12-08T17:17:29.251700,worldnews,Japan to deploy missiles on Yonaguni - Taipei Times,59,https://www.taipeitimes.com/News/front/archives/2025/11/25/2003847777,t3_1p5vka0,AI
2025-12-08T17:17:29.251700,worldnews,"Volodymyr Zelensky warns against giving away territory to Russia, as latest Ukraine talks end",2608,https://www.bbc.com/news/articles/cpd6qd10l94o?at_medium=RSS&at_campaign=rss,t3_1p5us1l,AI
2025-12-08T17:17:31.588341,worldnews,Tariff deal with U.S. 'not finalized' amid US$400 billion investment report | Focus Taiwan,35,https://focustaiwan.tw/business/202511220003,t3_1p5s848,AI
2025-12-08T17:17:31.588341,worldnews,"Taiwan's 'return to China' key to international order, Xi tells Trump",433,https://www.abc.net.au/news/2025-11-25/xi-jinping-and-donald-trump-reportedly-discuss-taiwan/106048382,t3_1p5rze8,AI
2025-12-08T17:17:31.588341,worldnews,Iran's Larijani urges direct conflict with Israel after IDF strike kills Hezbollah's Tabatabai,42,https://www.jpost.com/middle-east/iran-news/article-875066,t3_1p5qtf4,AI
2025-12-08T17:17:31.588341,worldnews,Kremlin Says European Counter-Proposal for Ukraine Peace Does Not Work for Russia,1849,https://www.usnews.com/news/world/articles/2025-11-24/kremlin-says-european-counter-proposal-for-ukraine-peace-does-not-work-for-russia,t3_1p5nial,AI
2025-12-08T17:17:31.588341,worldnews,"Ukraine makes significant changes to US ‘peace plan’, sources say",4277,https://www.theguardian.com/world/2025/nov/24/zelenskyy-trump-meeting-revised-us-peace-plan-ukraine-russia,t3_1p5mtvb,AI
2025-12-08T17:17:31.588341,worldnews,"Ukraine says it's investigating over 178,000 war crimes amid Trump peace plan talks",1545,https://www.axios.com/2025/11/24/ukraine-russia-war-crimes-us-trump-peace-talks-cbs-60-minutes,t3_1p5l4k2,AI
2025-12-08T17:17:31.588341,worldnews,"'Not option, but necessity': PM Modi calls for UNSC reforms at IBSA meet; urges united stand against terror | India News",52,https://timesofindia.indiatimes.com/india/not-option-but-necessity-pm-modi-calls-for-unsc-reforms-at-ibsa-meet-urges-united-stand-against-terror/amp_articleshow/125518724.cms,t3_1p5kv99,AI
2025-12-08T17:17:31.588341,worldnews,Poland charges another Ukrainian over suspected Russian-backed railway sabotage,146,https://kyivindependent.com/poland-charges-ukrainian-over-suspected-russian-backed-railway-sabotage/,t3_1p5kj7j,AI
2025-12-08T17:17:31.588341,worldnews,Controversial Gaza Humanitarian Foundation to close aid effort,96,https://www.cnn.com/2025/11/24/middleeast/gaza-humanitarian-foundation-to-close-intl?utm_medium=social&utm_campaign=missions&utm_source=reddit,t3_1p5k108,AI
2025-12-08T17:17:31.588341,worldnews,China criticises Japan's plan to deploy missiles on island near Taiwan,36,https://www.reuters.com/world/china/china-criticises-japans-plan-deploy-missiles-island-near-taiwan-2025-11-24/,t3_1p5jmlj,AI
2025-12-08T17:17:31.589341,worldnews,Criminal Gang Recruits Homeless Russians to Fight in Ukraine for Cash,607,https://united24media.com/latest-news/criminal-gang-recruits-homeless-russians-to-fight-in-ukraine-for-cash-13730,t3_1p5jf47,AI
2025-12-08T17:17:33.491839,worldnews,Spain's chief prosecutor quits after leak verdict,54,https://www.reuters.com/world/spains-chief-prosecutor-quits-after-leak-verdict-2025-11-24/,t3_1p5evce,AI
2025-12-08T17:17:33.491839,worldnews,TikTok boss insists teens' safety not at risk from AI moderation,75,https://news.sky.com/story/tiktok-boss-insists-teens-safety-not-at-risk-from-ai-moderation-13473610,t3_1p5cea5,AI
2025-12-08T17:17:33.491839,worldnews,Ukrainian Forces Hit Rare Bromine Plant and Critical Power Node in Crimea,1689,https://united24media.com/latest-news/ukrainian-forces-hit-rare-bromine-plant-and-critical-power-node-in-crimea-video-13704,t3_1p5c266,AI
2025-12-08T17:17:33.491839,worldnews,Trump’s Ukraine Peace Plan Would Grant Key Russian Demands,178,https://www.bloomberg.com/news/articles/2025-11-20/trump-s-ukraine-peace-plan-would-grant-key-russian-demands?srnd=phx-politics,t3_1p5brlk,AI
2025-12-08T17:17:33.491839,worldnews,COP30: India's delayed action plan raises eyebrows at UN climate summit,50,https://www.bbc.com/news/articles/cy8v8k8mlego,t3_1p5bmnt,AI
2025-12-08T17:17:33.491839,worldnews,US and Ukraine signal peace plan progress after Geneva talks,460,https://www.bbc.com/news/articles/ce3zwy808dpo?at_medium=RSS&at_campaign=rss,t3_1p58jto,AI
2025-12-08T17:17:33.491839,worldnews,"/r/WorldNews Live Thread: Russian Invasion of Ukraine Day 1369, Part 1 (Thread #1516)",562,https://www.reddit.com/live/18hnzysb1elcs,t3_1p5764s,AI
2025-12-08T17:17:33.491839,worldnews,"Airlines cancel international flights to Venezuela after US warns of worsening security, military activity",1859,https://www.indiatvnews.com/news/world/airlines-cancel-international-flights-to-venezuela-after-us-warns-of-worsening-security-military-activity-2025-11-24-1018783,t3_1p546jp,AI
2025-12-08T17:17:33.491839,worldnews,"US, Ukraine and European officials meet in Geneva for talks on peace plan",182,https://www.channelnewsasia.com/world/ukraine-russia-end-war-us-european-officials-geneva-talk-trump-plan-5485466,t3_1p525mr,AI
