timestamp,subreddit,title,score,url,id,keyword_matched
2025-12-08T17:10:34.704696,worldnews,China to provide $100 million humanitarian aid for Gaza,23,https://www.reuters.com/world/china/china-provide-100-million-humanitarian-aid-gaza-xi-says-2025-12-04/,t3_1phhjtw,AI
2025-12-08T17:10:34.704696,worldnews,"Step into the magic! ✨ Disney Dreamlight Valley is on sale, up to 30% OFF. 🏰 Build, explore, and live your dream adventure with Disney and Pixar friends. 💖 Offer valid for a limited time—don’t wait!",0,https://alb.reddit.com/cr?za=n0j6EkSmHMxY0Xqp2JEezY76US_t-gDWPrPee9YMBsEnljQ82draEMIud2vZme-_gLSS9o530Lmd2ONKnY3Gh4-mV_dTeLfy0wq09tgICW0zA9IP-Z97-FnciWaE0PJHYqbzZxfQUqSp7hpzsVcmhvg3dZ1oxRjKV7sGErM6Pk5ynIQnWQtHNYwEglmVVr5cLpBNgP0a4mWCl9kunPswsTZdgPmLbkPMzVcMp5wUJAMGq6pBgq70rgcgcVuAB7vEfddrWcv3Rc_SxwxpYOnyK_jlhPnEBaNsFfbbyi4Z8Ag3e76V2wq7m33aIt5AGMeaZPi7wGHXcieF2fn8LKWltCwKRMMktRAQ5sTjOYpKdlpQ_LRCGFz-2EgVD0sG-ESXj10D2TxN-5Ge9fI4KvOrdfyVM-czbmo1kp4niWbNdoAOio2-3zUYbOU-BaGBpRqanfLIheOZWKLfa70WCMqGILPjCgc1xhAVPG5q1xNwEZuRAPj5mGVwj1OF5W1W0XttjIBaF6ns6wLaNkdv_Oe2PFaLgxUHvtADKSywT3OOB7UyzpWY_ZyxHAgUsPTm9DQaJuIH3yjaUCmnF8mbTmcszaQq845rHc2QDtHAlgv705K1s3gBd2-LSwc&zp=V9NnmeoQMpG5NpsJ1EWXBBBhucUu_H9p5ORkcqTq3_j7azjV1DvIjRlC7ywQPUlG8x2KqXGpne0QomiKHrSw8DEEKPpCvlZBBmt8cKqvfw65Yr8aMZbOdMKOvZ42Z-LCgluP_S7VbWYmeNzx0X_e5mqnCvqHvKZxmXJ0-nrSY1nJF5KnrbY-6S9td_vEcJcS_lBv4irCBjgEuSZBHEtID9aXJEvn-NSOJafb3ZgpHKL0FYiIle1J3UAfMchGLIVusydKNNLWCoU0XJe_XQmNsoJpER7Zxab4gd7ILmwr92FxW2_efhuJrBIsLJGDF2s58VtgOO86TWuA_-ym1NXClMElgGjIpReyO52Xs1zw4RWQZxugTBNl5EiDgI0ojsN4ZmWr9f5JCve_mnVJlc-90skcMvyI0JRndDa5G1G6M-YGz-Gxrjj8IuYkT34HFjt9vR4ynKrBbaXWwF2R1FuseTFLmuwfVV2XBoOOnaVOQmGiM51fyyc8tEecVHyDXHpoHmaCRZqAPyoksPJKcASD9cXOleCuxMYYvRDsXOIjxh_idaQ8tZFplI2aBBAVEq_szqtZUVbQgkhyPlCA-5zO2Tb7tgRbUQz9Ow_s97IthdRycr-vKyUkTJDtD1t1vKVCTZRLAL4_LaRaqif_HpsmlZpf5nv2uo_9GFtfpjsciu5CQkqpfEANkiLP3zBXpxplCCMwoEZcHd95KwDsDiVHLSzemr5wpvrlLSNel9MWJG2JUsgCO1iRhXnBPppSgDp1etDU6qY6TWL33FidXDISfNzpDue8CfT3_IknRCkHVLwD-JwGpbwY3HfVrl6udcguyC8K7vz5_ohp0Y6Tug0-KODEMNbINnTl_CF9HsStsmj_aQhdWbyfDipZgsndhoptKLGr2MQdYiE0KO-XLvHcYxrOuezkxArH4xNE7z3QIOnIneVgn0Yj1npe5_BmWggEY0WV0O3Z995mE4zq9P6rr9nnykA-XAEheHRBj7XApdveAXMZnO1C25GhCsRm2owy2wvr9xPzvhMz90nO5hqf6f1aO0hPoT3i3G6ONUTIEuDrM2-t1DzFMH7IZCNHodwtTZP4BVwQuNMBIZFVZ6d38Sy9ZKVf1dKPKlIIAS87PA,t3_1phdzil,AI
2025-12-08T17:10:34.704696,worldnews,UN sets 2026 aid appeal below 1% of global arms spending – DW,2,https://www.dw.com/en/un-sets-2026-aid-appeal-below-1-of-global-arms-spending/a-75055111,t3_1phh49p,AI
2025-12-08T17:10:34.704696,worldnews,"Pakistan to sell 75% stake in national airline, bidding to begin ‘soon’",15,https://www.arabnews.com/node/2623348/pakistan,t3_1phgm4t,AI
2025-12-08T17:10:34.712807,worldnews,"United Arab Emirates-backed separatists tighten grip of southern Yemen, and airspace briefly closed",11,https://abcnews.go.com/Business/wireStory/united-arab-emirates-backed-separatists-tighten-grip-southern-128204126,t3_1phfql2,AI
2025-12-08T17:10:34.712807,worldnews,Thailand launches air strikes on Cambodia as border tensions reignite,22,https://www.straitstimes.com/asia/se-asia/thailand-launches-air-strikes-on-cambodia-after-soldier-is-killed,t3_1phesnm,AI
2025-12-08T17:10:34.712807,worldnews,Chinese court orders Malaysia Airlines to pay US$3.3 million in compensation over missing MH370 plane,29,https://www.channelnewsasia.com/east-asia/mh370-china-court-malaysia-airlines-compensation-5567776,t3_1phehzb,AI
2025-12-08T17:10:34.712807,worldnews,Sharks and Rays Gain Sweeping Protections From Wildlife Trade - A global treaty has extended trade protections to more than 70 shark and ray species whose numbers are in sharp decline.,52,https://www.nytimes.com/2025/12/02/science/wildlife-trade-cites-sharks-rays.html,t3_1phegzk,AI
2025-12-08T17:10:34.714177,worldnews,"Ukrainian drones destroy 70% of fuel tanks at Russia's Temryuk Seaport, General Staff says",5858,https://kyivindependent.com/ukrainian-drones-destroy-70-of-fuel-tanks-at-russias-temryuk-seaport-general-staff-says/,t3_1phdt7m,AI
2025-12-08T17:10:34.714177,worldnews,"Israeli surveillance targets US and allies at joint base planning Gaza aid and security, say sources",22,https://www.theguardian.com/world/2025/dec/08/israel-mass-surveillance-us-base-planning-gaza-future,t3_1phdsxv,AI
2025-12-08T17:16:04.390925,worldnews,European Council president warns US not to interfere in Europe’s affairs,10,https://www.theguardian.com/world/2025/dec/08/europe-leaders-no-longer-deny-relationship-with-us-changed,t3_1phi0fr,AI
2025-12-08T17:16:04.393129,worldnews,China to provide $100 million humanitarian aid for Gaza,28,https://www.reuters.com/world/china/china-provide-100-million-humanitarian-aid-gaza-xi-says-2025-12-04/,t3_1phhjtw,AI
2025-12-08T17:16:04.393129,worldnews,UN sets 2026 aid appeal below 1% of global arms spending – DW,3,https://www.dw.com/en/un-sets-2026-aid-appeal-below-1-of-global-arms-spending/a-75055111,t3_1phh49p,AI
2025-12-08T17:16:04.393129,worldnews,"Pakistan to sell 75% stake in national airline, bidding to begin ‘soon’",16,https://www.arabnews.com/node/2623348/pakistan,t3_1phgm4t,AI
2025-12-08T17:16:04.393129,worldnews,"United Arab Emirates-backed separatists tighten grip of southern Yemen, and airspace briefly closed",11,https://abcnews.go.com/Business/wireStory/united-arab-emirates-backed-separatists-tighten-grip-southern-128204126,t3_1phfql2,AI
2025-12-08T17:16:04.393129,worldnews,Thailand launches air strikes on Cambodia as border tensions reignite,24,https://www.straitstimes.com/asia/se-asia/thailand-launches-air-strikes-on-cambodia-after-soldier-is-killed,t3_1phesnm,AI
2025-12-08T17:16:04.393129,worldnews,Chinese court orders Malaysia Airlines to pay US$3.3 million in compensation over missing MH370 plane,29,https://www.channelnewsasia.com/east-asia/mh370-china-court-malaysia-airlines-compensation-5567776,t3_1phehzb,AI
2025-12-08T17:16:04.394128,worldnews,Sharks and Rays Gain Sweeping Protections From Wildlife Trade - A global treaty has extended trade protections to more than 70 shark and ray species whose numbers are in sharp decline.,53,https://www.nytimes.com/2025/12/02/science/wildlife-trade-cites-sharks-rays.html,t3_1phegzk,AI
2025-12-08T17:16:04.394128,worldnews,"Ukrainian drones destroy 70% of fuel tanks at Russia's Temryuk Seaport, General Staff says",6108,https://kyivindependent.com/ukrainian-drones-destroy-70-of-fuel-tanks-at-russias-temryuk-seaport-general-staff-says/,t3_1phdt7m,AI
2025-12-08T17:16:04.394128,worldnews,"Israeli surveillance targets US and allies at joint base planning Gaza aid and security, say sources",22,https://www.theguardian.com/world/2025/dec/08/israel-mass-surveillance-us-base-planning-gaza-future,t3_1phdsxv,AI
2025-12-08T17:16:06.681555,worldnews,Netherlands allocates additional EUR 700m to support Ukraine,336,https://www.pravda.com.ua/eng/news/2025/12/08/8010886/,t3_1phbt50,AI
2025-12-08T17:16:06.681555,worldnews,Russian Fighter Jet Crew Reportedly Killed After Ground Ejection System Failure,3542,https://united24media.com/latest-news/su-34su-24-crew-reportedly-killed-after-ground-ejection-system-failure-14085,t3_1pha5le,AI
2025-12-08T17:16:06.681555,worldnews,Norway police detain suspected shooter in Oslo shopping centre,24,https://www.reuters.com/world/norway-police-say-one-person-apprehended-after-reports-shooting-oslo-shopping-2025-12-08/,t3_1ph9m5s,AI
2025-12-08T17:16:06.681555,worldnews,Zelenskiy Says No Accord So Far on Eastern Ukraine in US Talks,93,https://www.bloomberg.com/news/articles/2025-12-08/zelenskiy-says-no-accord-so-far-on-eastern-ukraine-in-us-talks,t3_1ph9eya,AI
2025-12-08T17:16:06.681555,worldnews,Musk says EU 'should be abolished' after fine against X,0,https://www.lemonde.fr/en/international/article/2025/12/07/musk-says-eu-should-be-abolished-after-fine-against-x_6748235_4.html,t3_1ph96gp,AI
2025-12-08T17:16:06.681555,worldnews,Thailand launches airstrikes along border with Cambodia as ceasefire falters,41,https://www.cbsnews.com/news/thailand-launches-airstrikes-along-border-with-cambodia/,t3_1ph92na,AI
2025-12-08T17:16:06.681555,worldnews,“That’s what we get paid for”: Ukraine’s spy chief confirms ability to eavesdrop on Kremlin’s inner circle,2520,https://euromaidanpress.com/2025/12/08/thats-what-we-get-paid-for-ukraines-spy-chief-confirms-ability-to-eavesdrop-on-kremlins-inner-circle/,t3_1ph8k3m,AI
2025-12-08T17:16:06.682560,worldnews,"United States says peace deal ending Ukraine war is “really close,” but key issues remain",0,https://www.investing.com/news/commodities-news/us-envoy-kellogg-says-ukraine-peace-deal-is-really-close-4394717,t3_1ph7u0n,AI
2025-12-08T17:16:06.682560,worldnews,"China’s trade surplus tops record US$1 trillion, defying trade war uncertainty",1290,https://scmp.com/economy/economic-indicators/article/3335551/chinas-exports-rebound-november-after-trade-war-thaw,t3_1ph7802,AI
2025-12-08T17:16:06.682560,worldnews,Tensions flare again at Cambodia–Thailand border — air-​strikes after ceasefire collapse,26,https://www.hindustantimes.com/world-news/thailand-launches-air-strikes-near-disputed-border-with-cambodia-several-injured-101765158216147.html,t3_1ph5exl,AI
2025-12-08T17:16:09.390974,worldnews,Thailand launches air strikes at Cambodia as border tensions reignite,76,https://www.reuters.com/world/asia-pacific/thai-army-says-air-strikes-launched-along-disputed-border-area-with-cambodia-2025-12-08/,t3_1ph2x3n,AI
2025-12-08T17:16:09.390974,worldnews,Mid-air military stand-off triggers duelling protests in China-Japan row latest,64,https://www.scmp.com/news/china/diplomacy/article/3335547/mid-air-military-stand-triggers-duelling-protests-china-japan-row-latest?module=top_story&pgtype=homepage,t3_1ph1vjt,AI
2025-12-08T17:16:09.390974,worldnews,Thailand launches airstrikes along border with Cambodia as tensions reignite,91,https://apnews.com/article/thailand-cambodia-border-clash-9fe1894bdae727cf624efd2e3e14d3cd,t3_1ph1ukw,AI
2025-12-08T17:16:09.390974,worldnews,"Ukraine war briefing: Peace talks with US constructive but ‘not easy’, says Zelenskyy",56,https://www.theguardian.com/world/2025/dec/08/ukraine-war-briefing-peace-talks-with-us-constructive-but-not-easy-says-zelenskyy,t3_1ph1323,AI
2025-12-08T17:16:09.390974,worldnews,Real Wages in Japan Fall for 10th Straight Month in Oct.,50,https://jen.jiji.com/jc/eng?g=eco&k=2025120800162,t3_1ph0xy3,AI
2025-12-08T17:16:09.390974,worldnews,"Chinese carrier conducting intense air operations near Japan, Tokyo says",597,https://www.reuters.com/world/china/chinese-carrier-conducting-intense-air-operations-near-japan-tokyo-says-2025-12-08/,t3_1ph0my0,AI
2025-12-08T17:16:09.390974,worldnews,Thailand launches airstrikes on Cambodia as Trump’s peace agreement hangs in balance,9219,https://www.cnn.com/2025/12/07/asia/thailand-cambodia-border-clashes-december-intl-hnk,t3_1ph0h5l,AI
2025-12-08T17:16:09.390974,worldnews,Trump says Zelenskyy ‘isn’t ready’ yet to accept US-authored proposal to end Russia-Ukraine war,1037,https://apnews.com/article/ukraine-russia-war-kellogg-trump-zelenskyy-cf7422dc54d0f2415d164824c9d389a3,t3_1pgz2jg,AI
2025-12-08T17:16:09.390974,worldnews,South Korea’s Hyundai feeds rapid naval upgrades in the Philippines,344,https://www.defensenews.com/global/asia-pacific/2025/12/05/south-koreas-hyundai-feeds-rapid-naval-upgrades-in-the-philippines/,t3_1pgx977,AI
2025-12-08T17:16:09.390974,worldnews,Russian strike hits medicines warehouse of major Ukrainian pharmaceutical distributor,593,https://www.pravda.com.ua/eng/news/2025/12/07/8010807/,t3_1pgwz32,AI
2025-12-08T17:16:09.390974,worldnews,Russian troops caught in kill zone as Ukraine reclaims Ivanivka in daring counterattack,13037,https://euromaidanpress.com/2025/12/07/frontline-report-2025-12-07/,t3_1pgw0c3,AI
2025-12-08T17:16:09.392180,worldnews,Zelenskiy says Ukraine's peace talks with US constructive but not easy,176,https://www.reuters.com/world/europe/zelenskiy-says-ukraines-peace-talks-with-us-constructive-not-easy-2025-12-07/,t3_1pgvxao,AI
2025-12-08T17:16:09.392180,worldnews,Taipei rally voices migrant workers' anger over work-year limit - Focus Taiwan,14,https://focustaiwan.tw/society/202512070014,t3_1pgv255,AI
2025-12-08T17:16:11.315967,worldnews,"African swine fever outbreak in Spain may have leaked from research lab, officials say",246,https://www.theguardian.com/world/2025/dec/07/african-swine-fever-outbreak-in-spain-may-have-leaked-from-research-lab-officials-say,t3_1pgtmom,AI
2025-12-08T17:16:11.315967,worldnews,Italy's Meloni pledges emergency aid to Ukraine in call with Zelenskiy,5469,https://www.reuters.com/world/italys-meloni-pledges-emergency-aid-ukraine-call-with-zelenskiy-2025-12-07/,t3_1pgs6pi,AI
2025-12-08T17:16:11.315967,worldnews,Bullrich to file Argentinian Penal Code reform aimed at increasing sentences,25,https://buenosairesherald.com/politics/bullrich-to-file-argentine-penal-code-reform-aimed-at-increasing-sentences,t3_1pgqnyy,AI
2025-12-08T17:16:11.329994,worldnews,Russia Targets Strategic Pechenihy Dam—Ukraine Responds with Contingency Measures,90,https://united24media.com/latest-news/russia-targets-strategic-pechenihy-dam-ukraine-responds-with-contingency-measures-14076,t3_1pgowzw,AI
2025-12-08T17:16:11.329994,worldnews,"Russia launches missile and drone attacks on central, northern Ukraine, targeting energy infrastructure",276,https://kyivindependent.com/explosions-reported-in-kremenchuk-as-russia-launches-barrage-of-missiles-drones-towards-central-ukraine/,t3_1pgkgzb,AI
2025-12-08T17:16:11.329994,worldnews,"Philippines in Advanced Talks to Acquire KF-21 Boramae Fighter Jets from South Korea, Signaling a Strategic Shift in South China Sea Air Power",64,https://defencesecurityasia.com/en/philippines-kf-21-boramae-south-korea-fighter-negotiations-air-power/,t3_1pgk1og,AI
2025-12-08T17:16:13.376519,worldnews,"2 killed as Russian overnight attack hits infrastructure in Ukraine, officials say",136,https://abcnews.go.com/International/2-killed-russian-overnight-attack-hits-infrastructure-ukraine/story?id=128183253,t3_1pgh8ms,AI
2025-12-08T17:16:13.376519,worldnews,"Trump's envoy Kellogg says peace deal on Ukraine ""really close"" and depends on two issues",0,https://www.pravda.com.ua/eng/news/2025/12/07/8010756/,t3_1pggrag,AI
2025-12-08T17:16:13.376519,worldnews,Farage turns on broadcasters over racism allegations as number of claims hits 28,996,https://www.theguardian.com/politics/2025/dec/04/farage-turns-on-broadcasters-racism-allegations-bbc,t3_1pgf611,AI
2025-12-08T17:16:13.376519,worldnews,Germany scrambles to unlock €165bn in frozen Russian assets for Ukraine,4476,https://euromaidanpress.com/2025/12/06/frozen-russian-assets-ukraine-loan-merz-belgium/,t3_1pge650,AI
2025-12-08T17:16:13.376519,worldnews,Hong Kong Holds Vote as Officials Move Against ‘Anti-China’ Elements,31,https://www.nytimes.com/2025/12/07/world/asia/hong-kong-fire-election-campaign.html,t3_1pgcksa,AI
2025-12-08T17:16:13.376519,worldnews,"/r/WorldNews Live Thread: Russian Invasion of Ukraine Day 1382, Part 1 (Thread #1529)",543,https://www.reddit.com/live/18hnzysb1elcs,t3_1pg8t6g,AI
2025-12-08T17:16:13.376519,worldnews,Goa fire incident: At least 25 dead in cylinder blast at Arpora nightclub; CM orders detailed probe,27,https://economictimes.indiatimes.com/news/india/23-dead-in-midnight-blaze-at-goa-club-three-women-among-victims/articleshow/125812210.cms?from=mdr,t3_1pg8ezp,AI
2025-12-08T17:16:13.376519,worldnews,NATO fighters scrambled in Poland as Russia bombards Ukraine,3847,https://abcnews.go.com/International/nato-fighters-scrambled-poland-russia-bombards-ukraine/story?id=128167479,t3_1pg7zgk,AI
2025-12-08T17:16:15.579231,worldnews,"Ship in Bab el-Mandeb Strait attacked by suspected pirates, officials say",59,https://apnews.com/article/piracy-bab-mandeb-red-sea-aden-gulf-1856e53457c39fed4f8d827a58f87c98,t3_1pg7962,AI
2025-12-08T17:16:15.579231,worldnews,"Chinese jets directed fire-control radar at Japanese aircraft, Japan says",2363,https://www.reuters.com/world/china/chinese-fighter-jets-directed-radar-japanese-aircraft-japan-says-2025-12-06/,t3_1pg6j69,AI
2025-12-08T17:16:15.579231,worldnews,"US Promises Pre-Christmas Arms Boost for Ukraine, Pushes for Europe-Led NATO by 2027",448,https://www.kyivpost.com/post/65690,t3_1pg585q,AI
2025-12-08T17:16:15.579682,worldnews,"Ukraine will not accept any peace deal requiring territorial concessions, Syrskyi tells UK broadcaster",14808,https://kyivindependent.com/ukraine-will-not-accept-any-peace-deal-requiring-territorial-concessions-syrskyi-tells-uk-broadcaster/,t3_1pg1960,AI
2025-12-08T17:16:15.579682,worldnews,Russia unleashes massive drone and missile attack on Ukraine | CBC News,813,https://www.cbc.ca/news/world/russia-ukraine-attacks-amid-diplomatic-talks-9.7005804,t3_1pg0jn8,AI
2025-12-08T17:16:15.579682,worldnews,Ukraine’s Intelligence Hackers Cripple Major Russian Logistics Network,8298,https://www.kyivpost.com/post/65728,t3_1pg0ixj,AI
2025-12-08T17:16:15.579682,worldnews,"Looking for Blockchain servers? Discover Advance and Scale. Ready in 120 sec, available globally.",0,https://alb.reddit.com/cr?za=WdwdLcERNtSW63XqLW4a08dPkuppOVLbhfHw_R39Ybbl4WwsAIaehxBdqqlDBslJB3ucLrY1E0XwMCtkwRuE9nS0t7BSWi91jxYHlA7D_LB0NBqO1Wo3ieukGKM12HIZW9odJBr6mltRq_o5gvXTX64Pp5U-PxzGlRqjEXHEhM5eOX2lqKCN1tgzScoJZPOsfd_WNFp37GyFw4ywYs_MtPm63HYQRhh8_uk2TWRzV-uhd1QSKCsxC98t9IvoZJuECyqiipRYAkCcKUMYcDIgMa0K0JYiW6A7i6D9yyAS6nkSNzOK2VnwvOR5S_WPCFDB1yuOxKZx-ZX_g5SHFT_Tr_FjcB3eDtbpj8hSx6t_ctOn1Krj1X55IIs9Q4hF5YcHEMLYlKpuyzw7hZb-3ZSw6BuItOsEaUheiuwfBvt72NcZJ0h-1whyIFgwS7CoGD9ZYfxUjnDYpYFl31WUfFN5_81MKmlh5ImVN2OtlDwynfF73eFNJ4SJZfs054eX90lXk0JcbX0_8rkMdzKKmBoOldV6nvboYqtKjKnviujCfM7My9z3ID8yVG-YVLadycdVJH6cTiYoiYLJWN2cebvN_26MsG7IzaPsp232VifwiWLDtE5zbJWeNwE6HlivWpE2wZ48ncJX&zp=JGCijNWa6KcwzIj3M2ygOG2JvNXY2tIrF7n4DMNknoHaBuncG--9ROY6f81OTA7LqKJwEQfNRwcKa9Nn6dJsgRHWQctHnN2KZlUF3ya7KqqMKeSBqav8_GW2TqVxvC5ZRm4OOgTa7o7s4DduiT8Kru1WEZJ5fkKqOKjcSAVFUr6pEvVmWfP85Y14xB36uHpVsyUaIrampubUO0jL0gQO_swcQb7PhibkKiJN1wgp8E5HzS_i7-dhTHh-mnyJQg5ywfyarm5sk8WqJOeIVZ1R03KARdT_ORrQ7Gp4lbtRnz85ZWhs1hb0cnzZ4qWbTqAoiThtPTOg34DEibrUpYNdkD2TmgvEHPReF9HSayvazfhTHSSU-JMVOahPqUPwBe-7i_OO4wk4tFfTehMJ7U5oajIMX7ZLIH_guw4dSKLqU8IgRhJ6Zp_1MOr8WJKDznK2MK-gcPHmxKFXgkGS8AXHRpwe3C-8eHFBvxD1FTJi0iaVO8Hh2-ThW1NfBaDDpSBFNlot8IhFtFOQFcxGTh3P-NvW_qVQro3KTtkkA6LZwE2e_IatU0aaKbPgLt1r9vmXMhOfU2oEPPKX-Cs_XZIbWc2bf4iFUwqEKxSp8F-5xgKM6DxfoB7O5hMGBfUuGiqxjSiEw2pJT11DjMmMoQ69AGK_0AE0RQ--fnkrfBPkkd_mj1xWLM7TvX-WptWF2gXTTE-h2FGQfGe8KRBJ5-LW9IyLJTbykOtVOlbSviqYf8xUv_H6dK1SV7nY-s3Sf2zdvRcTTgxGkVSZGhA1dfcTnlNcsA7dMDREc1XqxDuZCe0boaz2WWCT9E2PW40cnF9ySUUMx0jMiR3ZzTyxbtzsW1D6BWOfZPFml6nJYfevsfqEXriWtCSXoX1oss5VZzBFy2wpJDg3rwqxjEQ4islWs5nB1OmKbFXZByTJClbuDimKoUd9d5WhYD9dM8kP9ZpSmIIRU650T8tn47QDE1K6P9mgDczacC3BlrxfM7ViGZRB_rGz_OYnXbs3Idd4HCE3-hIsPodgpuQifGNO38Tt9Yyp1tfnaB7WvniXw2yM6bJydx_FwQ,t3_1ph7i3j,AI
2025-12-08T17:16:15.579682,worldnews,Russia hits Ukraine as US reports progress in talks with Kyiv,202,https://www.bbc.com/news/articles/clydxj7my84o,t3_1pfyc4c,AI
2025-12-08T17:16:15.579682,worldnews,Battlefield Picture Worsening for Ukraine as Trump Pushes Peace Plan,0,https://www.nytimes.com/2025/12/06/world/europe/ukraine-pokrovsk-battlefield-russia.html,t3_1pfwnzk,AI
2025-12-08T17:16:15.579682,worldnews,"Von der Leyen, Merz: Talks with Belgium over the potential use of billions in frozen Russian assets to fund Ukraine were ‘constructive’.",762,https://www.politico.eu/article/ursula-von-der-leyen-friedrich-merz-talks-belgium-over-russian-assets-were-constructive/,t3_1pfs4ko,AI
2025-12-08T17:16:18.414306,worldnews,Four arrested after Tower of London display case containing State Crown defaced,1657,https://www.bbc.com/news/articles/cpd61w22e3no,t3_1pfqove,AI
2025-12-08T17:16:18.414306,worldnews,"Ukraine's Zaporizhzhia nuclear plant temporarily lost power overnight, IAEA says",251,https://www.reuters.com/business/energy/ukraines-zaporizhzhia-nuclear-plant-temporarily-lost-power-overnight-iaea-says-2025-12-06/,t3_1pfop79,AI
2025-12-08T17:16:18.414306,worldnews,"No calls, emails beyond official work hours: Right to Disconnect Bill introduced in Indian Parliament",2956,https://www.indiatoday.in/india/story/no-calls-emails-after-work-right-to-disconnect-bill-introduced-in-lok-sabha-2831729-2025-12-06,t3_1pfn2sg,AI
2025-12-08T17:16:18.414306,worldnews,US Urged Europeans to Oppose EU Plan for Loan to Support Ukraine,1175,https://www.bloomberg.com/news/articles/2025-12-05/us-urged-europeans-to-oppose-eu-plan-for-loan-to-support-ukraine?accessToken=eyJhbGciOiJIUzI1NiIsInR5cCI6IkpXVCJ9.eyJzb3VyY2UiOiJTdWJzY3JpYmVyR2lmdGVkQXJ0aWNsZSIsImlhdCI6MTc2NDk2MTg1MCwiZXhwIjoxNzY1NTY2NjUwLCJhcnRpY2xlSWQiOiJUNlM5WDVLR1pBSkIwMCIsImJjb25uZWN0SWQiOiI4QTlFOEY5NURDMTE0RjMxOERCNzM3MUZCQTdCRTUwOSJ9.EONkoD-RoOoAlaci4xaZ5WPn11JMbTbeRgN4AIbh22k,t3_1pfiome,AI
2025-12-08T17:16:18.414306,worldnews,Bombed Chornobyl shelter no longer blocks radiation and needs major repair – IAEA,10578,https://www.theguardian.com/world/2025/dec/06/chornobyl-disaster-shelter-no-longer-blocks-radiation-and-needs-major-repair-iaea?,t3_1pfihc5,AI
2025-12-08T17:16:18.414306,worldnews,"Giving up territory would be 'unjust peace', says Ukraine's armed forces chief",2347,https://news.sky.com/story/giving-up-territory-would-be-unacceptable-says-ukraines-armed-forces-chief-13479634,t3_1pfgfyv,AI
2025-12-08T17:16:18.414306,worldnews,"/r/WorldNews Live Thread: Russian Invasion of Ukraine Day 1381, Part 1 (Thread #1528)",563,https://www.reddit.com/live/18hnzysb1elcs,t3_1pffsqq,AI
2025-12-08T17:16:18.414306,worldnews,ICC prosecutor says Putin warrant won’t disappear even if Ukraine peace talks are successful,2864,https://abcnews.go.com/International/wireStory/icc-prosecutor-putin-warrant-wont-disappear-ukraine-peace-128146049,t3_1pffrvo,AI
2025-12-08T17:16:18.414306,worldnews,South Korean man jailed following DOC undercover gecko-smuggling sting,82,https://www.rnz.co.nz/news/national/581020/south-korean-man-jailed-following-doc-undercover-gecko-smuggling-sting,t3_1pff5f2,AI
2025-12-08T17:16:18.414306,worldnews,Hundreds of Australians complain of wrongful social media account closures but ombudsman can’t help,107,https://www.theguardian.com/technology/2025/dec/04/australians-wrongful-social-media-account-closures,t3_1pfdoo2,AI
2025-12-08T17:16:18.414306,worldnews,PLA holds urban warfare drill as Taipei looks to boost ‘asymmetric capabilities’,52,https://www.scmp.com/news/china/military/article/3335376/pla-holds-urban-warfare-drill-taipei-looks-boost-asymmetric-capabilities?module=top_story&pgtype=homepage,t3_1pfdbcq,AI
2025-12-08T17:16:20.481609,worldnews,Deterring Taiwan conflict a priority: US - Taipei Times,146,https://www.taipeitimes.com/News/front/archives/2025/12/06/2003848406,t3_1pf7t2u,AI
2025-12-08T17:16:20.482603,worldnews,Taiwan bans Chinese social media app RedNote for one year on fraud risks,451,https://www.cnbc.com/2025/12/05/taiwan-bans-chinese-social-media-app-xiaohongshu-for-one-year-on-fraud-risks.html,t3_1pf6wa9,AI
2025-12-08T17:16:20.482603,worldnews,"Putin arrest warrant will stand even if US-led peace talks agree Ukraine amnesty, ICC prosecutors say",8667,https://www.reuters.com/world/putin-arrest-warrant-will-stand-even-if-us-led-peace-talks-agree-ukraine-amnesty-2025-12-05/,t3_1pf4u8t,AI
2025-12-08T17:16:20.482603,worldnews,Iran's currency falls to a new low as nuclear sanctions squeeze its ailing economy,182,https://www.nbcnews.com/world/iran/irans-currency-falls-new-low-nuclear-sanctions-squeeze-ailing-economy-rcna247259,t3_1pf0yx2,AI
2025-12-08T17:16:20.482603,worldnews,"Moldova drafting Transnistria reintegration plan with Western partners, but keeping details under wraps",588,https://euromaidanpress.com/2025/12/04/moldova-drafting-transnistria-reintegration-plan/,t3_1pey20b,AI
2025-12-08T17:16:22.266361,worldnews,"Korean Industry Ministry and ARM sign deal to train over 1,400 chip specialists in Korea",28,https://koreajoongangdaily.joins.com/news/2025-12-05/business/industry/Industry-Ministry-ARM-sign-deal-to-train-over-1400-chip-specialists-in-Korea/2471046,t3_1pex0gw,AI
2025-12-08T17:16:22.266361,worldnews,China in diplomatic push to isolate Japan in feud over Taiwan issue,52,https://www.npr.org/2025/12/05/g-s1-100860/china-japan-feud-over-taiwan,t3_1pevtwx,AI
2025-12-08T17:16:22.266361,worldnews,Nvidia partner Foxconn reports 26% revenue spike as AI boom continues,38,https://www.cnbc.com/2025/12/05/nvidia-partner-foxconn-reports-26percent-revenue-spike-as-ai-boom-continues.html,t3_1peudky,AI
2025-12-08T17:16:22.266361,worldnews,"Sweden to cut development aid to five countries, divert money to Ukraine",12203,https://www.reuters.com/world/americas/sweden-cut-development-aid-five-countries-divert-money-ukraine-2025-12-05/,t3_1petwml,AI
2025-12-08T17:16:22.266361,worldnews,Hong Kong gov't slams 'biased' Wall Street Journal editorial on Tai Po fire,32,https://hongkongfp.com/2025/12/05/hong-kong-govt-slams-biased-wall-street-journal-editorial-on-tai-po-fire/,t3_1peskgd,AI
2025-12-08T17:16:22.266361,worldnews,Colombia’s Petro invites Trump to cocaine lab demolition amid attack threat,98,https://www.aljazeera.com/news/2025/12/3/colombias-petro-invites-trump-to-cocaine-lab-demolition-amid-attack-threat,t3_1pesa6h,AI
2025-12-08T17:16:22.266361,worldnews,Russia blocks Apple's FaceTime in mounting push against foreign tech platforms,178,https://www.reuters.com/business/retail-consumer/russia-imposes-restrictions-apples-facetime-app-agencies-say-2025-12-04/,t3_1pes647,AI
2025-12-08T17:16:24.924329,worldnews,Russian Troops Shoot Ukrainian POW in Donetsk Region Moments After Surrendering,15802,https://united24media.com/latest-news/russian-troops-shoot-ukrainian-pow-in-donetsk-region-moments-after-surrendering-14042,t3_1perf6v,AI
