timestamp,subreddit,title,score,url,id,keyword_matched
2025-12-08T17:16:24.924329,worldnews,"Taiwan, Japan voice concern over Chinese military movements",97,https://www.reuters.com/world/china/taiwan-japan-voice-concern-over-chinese-military-movements-2025-12-05/,t3_1peql2r,AI
2025-12-08T17:16:24.924329,worldnews,US Urged Europeans to Oppose EU Plan for Loan to Support Ukraine,400,https://www.bloomberg.com/news/articles/2025-12-05/us-urged-europeans-to-oppose-eu-plan-for-loan-to-support-ukraine,t3_1pepyql,AI
2025-12-08T17:16:24.924329,worldnews,Europe warns Zelenskyy against making concessions to Russia without firm US security guarantees – WSJ,1808,https://www.pravda.com.ua/eng/news/2025/12/05/8010454/,t3_1peps5q,AI
2025-12-08T17:16:24.924329,worldnews,Drone footage shows devastated Ukrainian town almost encircled by Russian forces,473,https://www.yahoo.com/news/articles/exclusive-drone-footage-shows-devastated-174757250.html,t3_1pepmmx,AI
2025-12-08T17:16:24.924329,worldnews,Hong Kong Baptist University suspends student union after messages urging gov’t heed concerns on Tai Po fire,44,https://hongkongfp.com/2025/12/05/hong-kong-baptist-university-suspends-student-union-after-messages-urging-govt-heed-concerns-on-tai-po-fire/,t3_1pep63p,AI
2025-12-08T17:16:24.924329,worldnews,'India-Russia friendship a time-tested one': PM Modi receives Vladimir Putin at airport,527,https://www.deccanherald.com/india/pm-modi-receives-russian-president-vladimir-putin-at-delhis-palam-airport-3819860,t3_1penekj,AI
2025-12-08T17:16:24.924329,worldnews,Macron Urges Xi to Help End War in Ukraine,315,https://www.nytimes.com/2025/12/04/world/asia/china-france-macron-ukraine.html,t3_1pemlec,AI
2025-12-08T17:16:24.924329,worldnews,"In Japan, Prime Minister Takaichi tries to avoid a ‘Truss shock’",124,https://www.asahi.com/ajw/articles/16203000,t3_1pelm6m,AI
2025-12-08T17:16:24.924329,worldnews,"/r/WorldNews Live Thread: Russian Invasion of Ukraine Day 1380, Part 1 (Thread #1527)",520,https://www.reddit.com/live/18hnzysb1elcs,t3_1pel9ru,AI
2025-12-08T17:16:24.924329,worldnews,Support increases for US intervention in potential Taiwan conflict | Taiwan News,257,https://taiwannews.com.tw/news/6258525,t3_1pejbi1,AI
2025-12-08T17:16:24.924329,worldnews,Cannabis Takes Root in Sagaing as Myanmar’s Post-Coup Drug Boom Expands,41,https://www.irrawaddy.com/news/burma/cannabis-takes-root-in-sagaing-as-myanmars-post-coup-drug-boom-expands.html,t3_1peiiiw,AI
2025-12-08T17:16:24.924329,worldnews,Thailand seizes more than $300m in assets and issues 42 arrest warrants in cyberscam crackdown,398,https://www.theguardian.com/world/2025/dec/04/thailand-scam-cyberscam-crackdown-arrests-south-east-asia,t3_1pegfgc,AI
2025-12-08T17:16:24.924329,worldnews,Milei in pole position as LLA claims first minority in Congress,20,https://www.batimes.com.ar/news/argentina/milei-in-pole-position-as-la-libertad-avanza-claims-first-minority-in-congress.phtml,t3_1pef8mm,AI
2025-12-08T17:16:24.924329,worldnews,"China, Russia discuss Ukraine, reach 'consensus' on Japan during Chinese minister's visit",47,https://www.reuters.com/world/china/china-russia-discuss-ukraine-reach-consensus-japan-during-chinese-ministers-2025-12-03/,t3_1pef8ll,AI
2025-12-08T17:16:24.924329,worldnews,"Lithuanian PM: Actions by Belarus, including balloons entering Lithuanian airspace and the detention of Lithuanian trucks on Belarusian territory, could be considered acts of terrorism",231,https://www.lrt.lt/en/news-in-english/19/2765280/lithuanian-pm-belarus-actions-could-be-recognised-as-terrorism,t3_1pef7l6,AI
2025-12-08T17:16:26.593455,worldnews,Taiwan to ban China's Xiaohongshu app for one year on fraud concerns,186,https://www.reuters.com/world/asia-pacific/taiwan-ban-chinas-xiaohongshu-app-one-year-fraud-concerns-2025-12-04/,t3_1pedkf1,AI
2025-12-08T17:16:26.593455,worldnews,"United Nations paid $11M to Syrian security firm owned by Assad intelligence services, documents show",116,https://www.icij.org/investigations/damascus-dossier/assad-intelligence-security-united-nations-aid/?utm_campaign=news&utm_medium=social&utm_source=reddit,t3_1pecy8g,AI
2025-12-08T17:16:26.593455,worldnews,Putin Says Russia Will Take All of Ukraine's Donbas Region Militarily or Otherwise,6997,https://english.aawsat.com/world/5215851-putin-says-russia-will-take-all-ukraines-donbas-region-militarily-or-otherwise,t3_1pecfqp,AI
2025-12-08T17:16:26.593455,worldnews,South Korea Starts Domestic Short-Range Air-to-Air Missile Program for the KF-21 Fighter Jet,50,https://www.armyrecognition.com/news/aerospace-news/2025/south-korea-starts-domestic-short-range-air-to-air-missile-program-for-the-kf-21-fighter-jet,t3_1pecda2,AI
2025-12-08T17:16:26.593455,worldnews,Putin says there are points he can't agree to in the U.S. proposal to end Ukraine war,1226,https://www.npr.org/2025/12/04/g-s1-100609/putin-ukraine-russia-war-us-peace-plan,t3_1pebcag,AI
2025-12-08T17:16:26.594578,worldnews,Italy Says Joining NATO’s Ukraine Weapons Program Is ‘Premature’ Amid Peace Talks,26,https://www.kyivpost.com/post/65539,t3_1pe9t4g,AI
2025-12-08T17:16:26.594578,worldnews,PM Modi receives Vladimir Putin at Delhi airport in rare diplomatic gesture,281,https://www.indiatoday.in/india/story/pm-modi-to-receive-vladimir-putin-at-delhi-airport-in-rare-diplomatic-gesture-sources-2830738-2025-12-04,t3_1pe939k,AI
2025-12-08T17:16:26.594578,worldnews,Putin says Russia disagrees with parts of US plan to end Ukraine war,305,https://www.bbc.com/news/articles/cgexgwr1wrro,t3_1pe7yeh,AI
2025-12-08T17:16:26.594578,worldnews,Finnish president warns Europe that US likely talked with Russia while negotiating with Ukraine,13314,https://kyivindependent.com/exclusive-finnish-president-warns-europe-that-us-likely-talks-with-russia-while-negotiating-with-ukraine/,t3_1pe6zt4,AI
2025-12-08T17:16:28.602554,worldnews,IndiGo: Over 300 flights cancelled as airline in India faces 'staff shortage crisis',41,https://www.bbc.com/news/articles/cn7kzj5485po,t3_1pe5711,AI
2025-12-08T17:16:28.603574,worldnews,"US halted plans to sanction Chinese spy agency to maintain trade truce, FT says",47,https://www.reuters.com/world/china/us-halted-plans-sanction-chinese-spy-agency-maintain-trade-truce-ft-says-2025-12-04/,t3_1pe3xkn,AI
2025-12-08T17:16:28.603574,worldnews,Czech POW sentenced to 13 years in jail by Russian court for fighting for Ukraine,195,https://kyivindependent.com/czech-pow-sentenced-to-13-years-jail-by-russian-court-for-fighting-for-ukraine/,t3_1pe2fd7,AI
2025-12-08T17:16:28.603574,worldnews,Taiwan rolls out handbook on how to prepare for natural disasters – and a Chinese invasion,150,https://edition.cnn.com/2025/11/18/asia/taiwan-handbook-china-invasion-disasters-intl-hnk,t3_1pe1fq0,AI
2025-12-08T17:16:28.603574,worldnews,"Russian troops advance in Vovchansk, Ukraine’s army holds city’s south, war monitors report",28,https://gwaramedia.com/en/russian-troops-advance-in-vovchansk-ukraines-army-holds-citys-south-war-monitors-report/,t3_1pe1bk3,AI
2025-12-08T17:16:28.603574,worldnews,"Ukraine Hits Over 50 Key Russian Targets, Degrading Military and Economic Strength",3238,https://united24media.com/latest-news/ukraine-hits-over-50-key-russian-targets-degrading-military-and-economic-strength-14015,t3_1pe1b1q,AI
2025-12-08T17:16:28.603574,worldnews,Argentina: Mileis´s lawmaker tainted by narco allegations resigns her senate seat.,23,https://buenosairesherald.com/politics/lla-lawmaker-tainted-by-narco-allegations-resigns-her-senate-seat-who-is-lorena-villaverde,t3_1pe16qm,AI
2025-12-08T17:16:28.603574,worldnews,"EU needs its own Ukraine peace plans, says defense commissioner",162,https://www.politico.eu/article/eu-needs-independent-us-ukraine-peace-efforts-defense-commissioner/,t3_1pe0sjt,AI
2025-12-08T17:16:28.603574,worldnews,U.S. commerce chief says Taiwan will help train American chip workers - Focus Taiwan,17,https://focustaiwan.tw/politics/202512040006,t3_1pe0m61,AI
2025-12-08T17:16:30.779757,worldnews,Ukraine's commander-in-chief says Ukrainian forces hold northern Pokrovsk and block attempts to bypass city,416,https://www.pravda.com.ua/eng/news/2025/12/04/8010314/,t3_1pdz77t,AI
2025-12-08T17:16:30.779757,worldnews,"Honduras election swings again, conservative Asfura takes slim lead",24,https://www.reuters.com/world/americas/honduras-election-swings-again-conservative-asfura-takes-slim-lead-2025-12-04/,t3_1pdz4bx,AI
2025-12-08T17:16:30.779757,worldnews,"Macron warned US could ‘betray’ Ukraine in leaked leaders’ call, Spiegel reports",27552,https://www.politico.eu/article/european-leaders-warn-us-could-betray-ukraine-in-leaked-call/,t3_1pdynk0,AI
2025-12-08T17:16:30.779757,worldnews,Deep-sea search for missing Malaysia Airlines Flight 370 to resume,33,https://www.cbc.ca/news/world/deep-sea-search-for-missing-malaysia-airlines-flight-370-to-resume-9.7001146,t3_1pdyehk,AI
2025-12-08T17:16:30.779757,worldnews,Berlin open to using Russian assets frozen in Germany to help Ukraine,2923,https://www.yahoo.com/news/articles/berlin-open-using-russian-assets-111226449.html,t3_1pdxmys,AI
2025-12-08T17:16:30.779757,worldnews,PM: Finland not prepared to offer security guarantees to Ukraine | Yle News,141,https://yle.fi/a/74-20197414,t3_1pdxbvr,AI
2025-12-08T17:16:30.779757,worldnews,Beijing ‘absolutely does not accept’ Japanese leader’s seeming Taiwan climbdown,392,https://www.scmp.com/news/china/diplomacy/article/3335213/beijing-absolutely-does-not-accept-japanese-leaders-seeming-taiwan-climbdown?module=top_story&pgtype=homepage,t3_1pdwudi,AI
2025-12-08T17:16:30.779757,worldnews,Pakistan to hold bidding to sell loss-making State-owned PIA airline,23,https://www.thehindu.com/news/international/pakistan-to-hold-bidding-to-sell-loss-making-state-owned-pia-airline/article70356518.ece,t3_1pdw7up,AI
2025-12-08T17:16:30.779757,worldnews,"Pope Francis left funds in his will to buy ambulances for Ukraine, nun says",35864,https://kyivindependent.com/pope-francis-left-funds-in-his-will-to-buy-ambulances-for-ukraine-nun-says/,t3_1pdvz2j,AI
2025-12-08T17:16:30.779757,worldnews,"Ukrainian Children Abducted by Russia Reportedly Sent to North Korea, US Senators Examine Evidence",6729,https://united24media.com/latest-news/ukrainian-children-abducted-by-russia-reportedly-sent-to-north-korea-us-senators-examine-evidence-13995,t3_1pdvf9l,AI
2025-12-08T17:16:30.779757,worldnews,Japan considering raising international traveler departure tax even more than previously reported,45,https://japantoday.com/category/travel/japan-considering-raising-international-traveler-departure-tax-even-more-than-previously-reported,t3_1pdv8du,AI
2025-12-08T17:16:30.779757,worldnews,"Macron calls on China to help end war in Ukraine, rebalance trade",345,https://www.lemonde.fr/en/international/article/2025/12/04/macron-tells-xi-that-france-and-china-must-overcome-their-differences_6748135_4.html,t3_1pduzp3,AI
2025-12-08T17:16:30.780757,worldnews,"Macron urges Xi to step up efforts on Ukraine, rebalancing global trade",50,https://www.reuters.com/world/china/chinas-president-xi-jinping-met-french-president-emmanual-macron-beijing-2025-12-04/,t3_1pdtn2h,AI
2025-12-08T17:16:32.723935,worldnews,"Bulldozed corpses and unmarked graves, CNN investigates the fate of Gaza’s missing aid seekers",254,https://edition.cnn.com/2025/12/03/middleeast/bulldozed-corpses-gaza-israel-zikim-aid-intl-vis-invs,t3_1pdt5kt,AI
2025-12-08T17:16:32.723935,worldnews,Remains of Thai national Sudthisak Rinthalak identified; one hostage remains in Gaza,284,https://www.ynetnews.com/article/bkmfzqcz11g,t3_1pdrbno,AI
2025-12-08T17:16:32.723935,worldnews,"/r/WorldNews Live Thread: Russian Invasion of Ukraine Day 1379, Part 1 (Thread #1526)",537,https://www.reddit.com/live/18hnzysb1elcs,t3_1pdq40p,AI
2025-12-08T17:16:32.723935,worldnews,Search for Malaysia Airlines flight MH370 to resume 11 years after it went missing,110,https://news.sky.com/story/search-for-malaysia-airlines-flight-mh370-to-resume-11-years-after-it-went-missing-13478684,t3_1pdlrdb,AI
2025-12-08T17:16:32.723935,worldnews,Trump signs bill on Taiwan into law - Taipei Times,72,https://www.taipeitimes.com/News/front/archives/2025/12/04/2003848281,t3_1pdjv1x,AI
2025-12-08T17:16:32.723935,worldnews,"Taiwan Cheered, China Upset After Trump Signs New Taiwan Legislation Into Law",5941,https://www.usnews.com/news/world/articles/2025-12-03/taiwan-cheered-china-upset-after-trump-signs-new-taiwan-legislation-into-law,t3_1pdjb5j,AI
2025-12-08T17:16:32.723935,worldnews,"Belgium Opposes Seizing Russian Assets, Says Moscow’s Defeat Is “a Fairy Tale”",1198,https://united24media.com/latest-news/belgium-opposes-seizing-russian-assets-says-moscows-defeat-is-a-fairy-tale-13993,t3_1pdja22,AI
2025-12-08T17:16:32.723935,worldnews,"floods in Indonesia, Sir Lanka, Thailand and Vietnam have killed 1200 people",79,https://www.nytimes.com/2025/12/01/world/asia/flooding-sri-lanka-indonesia-thailand-vietnam-cyclone-rain.html,t3_1pdhkyf,AI
2025-12-08T17:16:34.767326,worldnews,Hong Kong high-rise fire death toll rises to 159 as authorities arrest 6 over failed fire alarms,95,https://apnews.com/article/hong-kong-tai-po-fire-highrise-a82446d3ade61c71c1915f29d89cb35c,t3_1pdg0nz,AI
2025-12-08T17:16:34.767326,worldnews,Israel receives coffin that Hamas says contains Gaza hostage's body,32,https://www.bbc.com/news/articles/cd6x2j4g3z7o,t3_1pdc6mq,AI
2025-12-08T17:16:34.767326,worldnews,Spain faces 2.3 million citizenship requests from Franco-era exiles,104,https://www.euronews.com/2025/12/03/spain-overwhelmed-by-23-million-citizenship-applications-from-franco-era-descendants,t3_1pdbv4v,AI
2025-12-08T17:16:34.767326,worldnews,European Commission plans ‘reparations loan’ to Ukraine using frozen Russian assets,621,https://www.theguardian.com/world/2025/dec/03/european-commission-reparations-loan-ukraine-frozen-russian-assets,t3_1pdbikr,AI
2025-12-08T17:16:34.767326,worldnews,Romanian military forces destroy Ukrainian Sea Baby drone in Black Sea,0,https://newsukraine.rbc.ua/news/romanian-military-forces-destroy-ukrainian-1764781547.html,t3_1pdaal8,AI
2025-12-08T17:16:34.767326,worldnews,"EU plans to send €90 billion aid package to Ukraine in two years, as Kremlin allocates 40% of its budget for war in 2026",1150,https://euromaidanpress.com/2025/12/03/eu-plans-to-send-e90-billion-aid-package-to-ukraine-in-two-years-as-kremlin-allocates-40-of-its-budget-for-war-in-2026/,t3_1pdaa3f,AI
2025-12-08T17:16:34.767326,worldnews,Spain plans wild boar cull amid swine fever outbreak that hit exports,27,https://www.reuters.com/business/healthcare-pharmaceuticals/spain-plans-wild-boar-cull-curb-population-after-swine-fever-outbreak-2025-12-03/,t3_1pda98f,AI
2025-12-08T17:16:34.767326,worldnews,US on track for €4.3bn in weapons sales for Ukraine through NATO,299,https://www.euronews.com/my-europe/2025/12/03/europe-canada-on-track-to-buy-43bn-of-us-weapons-for-ukraine-this-year-rutte-says,t3_1pda3f3,AI
2025-12-08T17:16:34.767326,worldnews,Trump signs Taiwan Assurance Implementation Act into law,59,https://focustaiwan.tw/politics/202512030006,t3_1pd9sei,AI
2025-12-08T17:16:34.767326,worldnews,Britain says Putin’s war threats are ‘claptrap’,3274,https://www.politico.eu/article/vladimir-putin-keir-starmer-uk-russia-war-threats-are-claptrap/,t3_1pd8z6a,AI
2025-12-08T17:16:34.767326,worldnews,Israel receives remains of possible hostage and plans to reopen Gaza crossing into Egypt,27,https://www.ctvnews.ca/world/israel-hamas-war/article/israel-says-it-will-start-letting-palestinians-leave-gaza-through-reopened-border-crossing/,t3_1pd8ot4,AI
2025-12-08T17:16:34.767326,worldnews,China blasts UK for delaying decision again on massive London embassy,31,https://apnews.com/article/china-london-embassy-espionage-approval-delay-c5fd0755637a864566530231666904c5,t3_1pd8mwm,AI
2025-12-08T17:16:34.767326,worldnews,Thailand lifts ban on afternoon alcohol sales,71,https://www.channelnewsasia.com/asia/thailand-lifts-afternoon-alcohol-sales-ban-5531636,t3_1pd8268,AI
2025-12-08T17:16:34.767326,worldnews,Greece to Repay €5.29 Billion Early Under First Bailout Loans,1526,https://greekreporter.com/2025/12/03/greece-repay-early-first-bailout-loans/,t3_1pd7dlk,AI
2025-12-08T17:16:37.656892,worldnews,Germany deploys Arrow air defence to counter Russian missile threat,174,https://www.reuters.com/business/aerospace-defense/germany-deploys-arrow-air-defence-counter-russian-missile-threat-2025-12-03/,t3_1pd6r3a,AI
2025-12-08T17:16:37.656892,worldnews,"Rubio says Iran, Hezbollah built a foothold in Venezuela, raising US security concerns",755,https://english.alarabiya.net/News/united-states/2025/12/03/rubio-says-iran-hezbollah-built-a-foothold-in-venezuela-raising-us-security-concerns-,t3_1pd6k4o,AI
2025-12-08T17:16:37.656892,worldnews,"AI companies' safety practices fail to meet global standards, study shows",44,https://www.reuters.com/business/ai-companies-safety-practices-fail-meet-global-standards-study-shows-2025-12-03/,t3_1pd6cye,AI
2025-12-08T17:16:37.656892,worldnews,NATO allies pledge over $1 billion for US arms for Ukraine,3454,https://kyivindependent.com/nato-allies-pledge-over-1-billion-for-us-arms-for-ukraine/,t3_1pd5wzz,AI
2025-12-08T17:16:37.656892,worldnews,"Putin threatens Europe with war if it wants one, as Ukraine peace talks falter",238,https://www.cnbc.com/2025/12/03/russia-ready-for-war-with-europe-putin-says-before-ukraine-peace-talks.html,t3_1pd5jt2,AI
2025-12-08T17:16:37.656892,worldnews,Fitch : Greece is placed in the narrow core of countries that will manage to maintain surpluses - It will show the largest debt reduction in Europe in 2019-2026,79,https://en.protothema.gr/2025/12/03/fitch-greece-at-the-strong-core-of-a-two-speed-europe-in-2026/,t3_1pd5eum,AI
2025-12-08T17:16:37.656892,worldnews,Von der Leyen pushes ahead with reparations loan for Ukraine as Belgium maintains its opposition,194,https://www.euronews.com/my-europe/2025/12/03/von-der-leyen-pushes-ahead-with-reparations-loan-for-ukraine-as-belgium-maintains-its-oppo,t3_1pd5bzl,AI
2025-12-08T17:16:37.656892,worldnews,"Family of Colombian fisherman killed in strike in the Caribbean files formal complaint against US: “By carrying out this extrajudicial killing, the United States has violated the American Declaration of the Rights and Duties of Man”",9190,https://english.elpais.com/international/2025-12-03/family-of-colombian-fisherman-killed-in-strike-in-the-caribbean-files-formal-complaint-against-us.html,t3_1pd30uj,AI
2025-12-08T17:16:37.656892,worldnews,Eva Kaili to Mogherini: Belgium ‘not a safe place’ for politicians,26,https://www.politico.eu/article/eva-kaili-federica-mogherini-college-europe-eeas-investigation-qatargate/,t3_1pd2n4y,AI
2025-12-08T17:16:37.656892,worldnews,"Druzhba Pipeline ‘Will Keep Exploding and Burning,’ Ukraine Says After New Dec. 1 Strike",3023,https://www.kyivpost.com/post/65496,t3_1pd1i5e,AI
2025-12-08T17:16:37.656892,worldnews,"Germany steps up funding for US weapons for Ukraine, minister says",691,https://www.yahoo.com/news/articles/germany-steps-funding-us-weapons-083639676.html,t3_1pd1cm7,AI
2025-12-08T17:16:37.656892,worldnews,Ukraine Hits Two Oil Facilities in Russia in Overnight Drone Wave,20561,https://www.kyivpost.com/post/65466,t3_1pczt9f,AI
2025-12-08T17:16:39.937519,worldnews,India trashes Pakistan's claim of denial of overflight to send aid to Sri Lanka,73,https://www.thehindu.com/news/national/india-trashes-pakistans-claim-of-denial-of-overflight-to-send-aid-to-sri-lanka/article70351170.ece/amp/,t3_1pczrc8,AI
2025-12-08T17:16:39.937519,worldnews,Russia says no Ukraine compromise reached after five-hour Putin talks with Trump envoys,659,https://www.reuters.com/world/china/putin-witkoff-discuss-peace-options-ukraine-past-moscows-midnight-2025-12-02/,t3_1pcxe3d,AI
2025-12-08T17:16:39.937519,worldnews,Search for Malaysia Airlines flight MH370 to resume over 11 years after plane went missing,996,https://www.theguardian.com/world/2025/dec/03/search-for-malaysia-airline-flight-mh370-to-resume-over-11-years-after-plane-went-missing,t3_1pcvjmu,AI
2025-12-08T17:16:39.937519,worldnews,"Russia-US talks on Ukraine peace deal end without breakthrough, Putin aide says",260,https://edition.cnn.com/2025/12/02/europe/russia-ukraine-putin-us-witkoff-talks-intl-hnk,t3_1pcvim0,AI
2025-12-08T17:16:39.937519,worldnews,"/r/WorldNews Live Thread: Russian Invasion of Ukraine Day 1378, Part 1 (Thread #1525)",544,https://www.reddit.com/live/18hnzysb1elcs,t3_1pcu5u4,AI
2025-12-08T17:16:39.937519,worldnews,"European Commission plans to make a legal proposal this week to use frozen Russian assets to fund Ukraine, sources tell Reuters",716,https://www.reuters.com/business/european-commission-move-ahead-with-proposal-use-russias-frozen-assets-ukraine-2025-12-02/,t3_1pcovyn,AI
2025-12-08T17:16:39.937519,worldnews,Putin Warns of Possible Strikes on Ukrainian Allies’ Ships,1966,https://www.bloomberg.com/news/articles/2025-12-02/putin-warns-russia-may-hit-ukraine-allies-ships-if-attacks-last,t3_1pcidso,AI
2025-12-08T17:16:39.937519,worldnews,"More than 1,000 Amazon workers warn rapid AI threatens Democracy, Jobs and Earth's climate",755,https://www.theguardian.com/technology/2025/nov/28/amazon-ai-climate-change,t3_1pchva7,AI
2025-12-08T17:16:42.314208,worldnews,Putin accuses Europeans of sabotaging U.S.-led peace efforts in Ukraine,190,https://www.pbs.org/newshour/world/putin-accuses-europeans-of-sabotaging-u-s-led-peace-efforts-in-ukraine,t3_1pcgdzx,AI
2025-12-08T17:16:42.314208,worldnews,Pope Leo Warns Trump Not To Launch War Against Venezuela’s Maduro,5044,https://www.newsweek.com/pope-leo-warns-trump-not-to-launch-war-against-venezuelas-maduro-11143254,t3_1pceqsa,AI
2025-12-08T17:16:42.314208,worldnews,Pope Leo urges against US incursion of Venezuela as he warns Western countries to be ‘less fearful’ of immigrants,667,https://www.cnn.com/2025/12/02/americas/pope-leo-us-venezuela-immigrants-western-countries-intl-latam?utm_medium=social&utm_campaign=missions&utm_source=reddit,t3_1pce0be,AI
2025-12-08T17:16:42.314208,worldnews,Apple could face EU-wide collective claims after top European court backs Dutch jurisdiction,55,https://uk.advfn.com/market-news/article/8807/apple-could-face-eu-wide-collective-claims-after-top-court-backs-dutch-jurisdiction,t3_1pcdsdh,AI
2025-12-08T17:16:42.314208,worldnews,"Ukraine, US discuss safeguards against Russian strikes, potential ceasefire violations, Zelensky says",235,https://kyivindependent.com/ukraine-us-discuss-safeguards-against-russian-strikes-potential-ceasefire-violations-zelensky-says/,t3_1pcchgn,AI
2025-12-08T17:16:42.314208,worldnews,US Closes One of the Communication Channels With Germany Regarding Assistance to Ukraine,1355,https://militarnyi.com/en/news/us-closes-one-of-the-communication-channels-with-germany-regarding-assistance-to-ukraine/,t3_1pcb1cw,AI
2025-12-08T17:16:42.314208,worldnews,"Defence Ministry: Russia dropped 44,000 glide bombs at Ukraine during 2025",215,https://gwaramedia.com/en/defence-ministry-russia-dropped-44000-glide-bombs-at-ukraine-during-2025/,t3_1pc90y3,AI
2025-12-08T17:16:42.314208,worldnews,Taiwan Charges Tokyo Electron in TSMC Secrets Theft Case,39,https://www.bloomberg.com/news/articles/2025-12-02/taiwan-charges-tokyo-electron-in-tsmc-secrets-theft-case,t3_1pc7g8j,AI
2025-12-08T17:16:42.314208,worldnews,Briton detained in Ukraine on suspicion of spying for Russia to make 'easy money',298,https://news.sky.com/story/briton-detained-in-ukraine-on-suspicion-of-spying-for-russia-to-make-easy-money-13478201,t3_1pc7g82,AI
2025-12-08T17:16:43.955668,worldnews,Belgian police raid European External Action Service in anti-fraud operation,53,https://www.euronews.com/my-europe/2025/12/02/belgian-police-raid-european-external-action-service-in-anti-fraud-operation,t3_1pc790z,AI
2025-12-08T17:16:43.955668,worldnews,China sends another letter to UN chief over Takaichi's Taiwan remark,37,https://www3.nhk.or.jp/nhkworld/en/news/20251202_11/,t3_1pc5txa,AI
2025-12-08T17:16:43.955668,worldnews,‘Like a tsunami’: Asia reels from deadly cyclones and monsoon rains | CNN,60,https://edition.cnn.com/2025/12/02/asia/thailand-asia-flooding-disaster-intl-hnk,t3_1pc5dwh,AI
2025-12-08T17:16:43.955668,worldnews,U.S. envoy in Moscow for high-stakes Ukraine peace talks with Putin,50,https://www.nbcnews.com/world/russia/witkoff-moscow-putin-ukraine-peace-talks-trump-zelenskyy-rcna246928,t3_1pc57z5,AI
2025-12-08T17:16:43.955668,worldnews,Landfill work gets underway for US base transfer within Okinawa - The Mainichi,42,https://mainichi.jp/english/articles/20251128/p2g/00m/0na/035000c,t3_1pc4bwp,AI
2025-12-08T17:16:43.955668,worldnews,Rubio Calls German Counterpart as Merz Rejects ‘Dictated Peace’ for Ukraine,1604,https://www.kyivpost.com/post/65360,t3_1pc15mm,AI
2025-12-08T17:16:43.955668,worldnews,India and China trade barbs after passenger detained at Shanghai airport,81,https://www.bbc.com/news/articles/c8e9kz127w0o,t3_1pbziaf,AI
2025-12-08T17:16:43.955668,worldnews,"/r/WorldNews Live Thread: Russian Invasion of Ukraine Day 1377, Part 1 (Thread #1524)",599,https://www.reddit.com/live/18hnzysb1elcs,t3_1pbykx8,AI
2025-12-08T17:16:43.955668,worldnews,Russia Starts Issuing Draft Notices at Airports to New Citizens and Returning Expats,14936,https://united24media.com/latest-news/russia-starts-issuing-draft-notices-at-airports-to-new-citizens-and-returning-expats-13919,t3_1pbw2jn,AI
2025-12-08T17:16:43.955668,worldnews,Putin says Russia has taken control of 2 Ukrainian cities. Ukraine denies claims,2309,https://abcnews.go.com/International/putin-russia-control-2-ukrainian-cities-ukraine-denies/story?id=128018937,t3_1pbuzd4,AI
2025-12-08T17:16:43.955668,worldnews,"Thousands rally in Bulgaria against 2026 budget, clash with police",79,https://www.reuters.com/world/thousands-rally-bulgaria-against-2026-budget-clash-with-police-2025-12-01/,t3_1pbu57k,AI
