timestamp,subreddit,title,score,url,id,keyword_matched
2025-12-08T17:16:46.721223,worldnews,Pope Leo Tells Students 'Don't Ask AI to Do Your Homework' During Virtual Appearance at Youth Conference,3552,https://people.com/pope-leo-tells-students-not-to-ask-ai-to-do-homework-11857450,t3_1pbpvwy,AI
2025-12-08T17:16:46.721223,worldnews,"Flooding in Indonesia, Thailand and Sri Lanka kills more than 1,160 people as recovery efforts continue",89,https://www.abc.net.au/news/2025-12-02/more-than-1000-dead-in-flooding-in-indonesia-thailand-sri-lanka/106089220,t3_1pbpb6e,AI
2025-12-08T17:16:46.721223,worldnews,Canadian air passenger traffic to U.S. down for 9th consecutive month,11461,https://globalnews.ca/news/11554355/canada-us-air-travel-ninth-straight-drop/,t3_1pbnmoo,AI
2025-12-08T17:16:46.721223,worldnews,India said to pitch new arms deal with Russia during Putin visit,152,https://www.thehindubusinessline.com/news/world/india-said-to-pitch-new-arms-deal-with-russia-during-putin-visit/article70343951.ece,t3_1pbk7sv,AI
2025-12-08T17:16:46.721223,worldnews,OBR chair quits in the U.K. after inquiry into the early release of Reeves's budget,22,https://www.theguardian.com/business/2025/dec/01/obr-chair-inquiry-early-release-rachel-reeves-budget-richard-hughes,t3_1pbigu2,AI
2025-12-08T17:16:46.721223,worldnews,Lithuania capital airport closes again over balloons,94,https://uk.news.yahoo.com/lithuania-capital-airport-closes-again-165635224.html,t3_1pbi1xm,AI
2025-12-08T17:16:46.721223,worldnews,"After uproar, Dublin shelves plan to remove Chaim Herzog’s name from park",228,https://jewishinsider.com/2025/12/ireland-chaim-herzog-dublin-park-antisemitism-israel-boycott/,t3_1pbgwwa,AI
2025-12-08T17:16:46.721223,worldnews,Tai Po fire: 2 arrested for allegedly inciting hatred of gov't - reports,73,https://hongkongfp.com/2025/12/01/tai-po-fire-ex-local-councillor-and-volunteer-arrested-for-allegedly-inciting-hatred-of-govt-reports,t3_1pbgixk,AI
2025-12-08T17:16:49.641998,worldnews,"Third Russia-Linked Oil Tanker Suffers Explosions at Sea | An oil tanker carrying diesel suffered four external explosions near Dakar, Senegal, its manager said",2840,https://www.bloomberg.com/news/articles/2025-12-01/oil-tanker-mersin-suffered-explosions-off-senegal-manager-says,t3_1pbg382,AI
2025-12-08T17:16:49.641998,worldnews,French mayor jailed in sex-tape blackmail case,283,https://www.lemonde.fr/en/france/article/2025/12/01/french-mayor-jailed-in-sex-tape-blackmail-case_6748025_7.html,t3_1pbevy3,AI
2025-12-08T17:16:49.643309,worldnews,Dutch soldiers to take charge of Patriot air defence in Poland,1126,https://www.dutchnews.nl/2025/12/dutch-soldiers-to-take-charge-of-patriot-air-defence-in-poland/,t3_1pbdomt,AI
2025-12-08T17:16:49.643309,worldnews,"F-16 ammunition, air defenses — Netherlands announces $290 million Ukraine aid package",2932,https://kyivindependent.com/f-16-ammunition-air-defenses-netherlands-announces-290-million-ukraine-aid-package/,t3_1pbbbq3,AI
2025-12-08T17:16:49.643309,worldnews,Tai Po fire: Ex-local councillor and volunteer arrested for allegedly inciting hatred of Hong Kong gov’t – reports,46,https://hongkongfp.com/2025/12/01/tai-po-fire-ex-local-councillor-and-volunteer-arrested-for-allegedly-inciting-hatred-of-govt-reports/,t3_1pbb2z2,AI
2025-12-08T17:16:49.643309,worldnews,EU tells Trump: You can’t pardon Putin for war crimes in Ukraine,27714,https://www.politico.eu/article/donald-trump-vladimir-putin-war-crimes-volodymyr-zelenskyy-ukraine/,t3_1pb9dlu,AI
2025-12-08T17:16:49.643309,worldnews,Morocco and Spain Set to Meet for 13th High-Level Meeting,57,https://www.moroccoworldnews.com/2025/12/270129/morocco-and-spain-set-to-meet-for-13th-high-level-meeting/,t3_1pb957m,AI
2025-12-08T17:16:49.643309,worldnews,"Floods in Indonesia, Sri Lanka, Thailand leave close to 1,000 dead | Climate Crisis News",107,https://www.aljazeera.com/news/2025/12/1/floods-in-indonesia-sri-lanka-thailand-leave-close-to-1000-dead,t3_1pb8gwn,AI
2025-12-08T17:16:49.643309,worldnews,Ukraine’s interceptor drone downs Russia’s jet-propelled Shahed UAV in historic first,7193,https://euromaidanpress.com/2025/12/01/ukraines-interceptor-drone-downs-russias-jet-propelled-shahed-uav-in-historic-first/,t3_1pb7toy,AI
2025-12-08T17:16:52.174622,worldnews,"/r/WorldNews Live Thread: Russian Invasion of Ukraine Day 1376, Part 1 (Thread #1523)",620,https://www.reddit.com/live/18hnzysb1elcs,t3_1pb2thm,AI
2025-12-08T17:16:52.174622,worldnews,'Autumn Struggle' marchers slam Lai's NT$1.25 trillion defense plan - Focus Taiwan,21,https://focustaiwan.tw/politics/202511300016,t3_1pazy3e,AI
2025-12-08T17:16:52.174622,worldnews,"Death toll passes 900 in Indonesia, Thailand and Sri Lanka floods",1149,https://www.theguardian.com/world/2025/nov/30/indonesia-thailand-floods,t3_1pauqxl,AI
2025-12-08T17:16:52.174622,worldnews,Kazakhstan Tells Ukraine To Stop Attacking Terminal After Oil Exports Halted,1370,https://gcaptain.com/kazakhstan-tells-ukraine-to-stop-attacking-terminal-after-oil-exports-halted/,t3_1parpdk,AI
2025-12-08T17:16:52.174622,worldnews,"Private US–Russia Plan for Ukraine ‘Like Nord Stream but Times a Hundred’, Warns Sikorski",2690,https://www.kyivpost.com/post/65262,t3_1paq4zo,AI
2025-12-08T17:16:52.174622,worldnews,Putin signs decree formalizing Russification of occupied Ukraine through 2036,6620,https://euromaidanpress.com/2025/11/27/russification-of-occupied-ukraine-putin-decree-2036/,t3_1pah61p,AI
2025-12-08T17:16:52.174622,worldnews,Orbán wants Ukraine to be buffer zone and blames West for prolonging war,487,https://www.pravda.com.ua/eng/news/2025/11/30/8009602/,t3_1paen6g,AI
2025-12-08T17:16:52.174622,worldnews,Egypt training Palestinians for future Gaza police force,165,https://www.ctvnews.ca/world/article/egypt-trains-hundreds-of-palestinians-for-future-gaza-police-force/,t3_1paemim,AI
2025-12-08T17:16:52.174622,worldnews,"U.S. military detains civilian, raising Okinawa police concerns | The Asahi Shimbun: Breaking News, Japan News and Analysis",432,https://www.asahi.com/sp/ajw/articles/16188514,t3_1paeh70,AI
2025-12-08T17:16:54.814780,worldnews,Qatar calls on Israel to continue ceasefire deal despite hostages remaining in Gaza,68,https://www.jpost.com/middle-east/article-876645,t3_1pad0tl,AI
2025-12-08T17:16:54.830934,worldnews,Putin must accept ceasefire with Ukraine or face new sanctions - French FM,4013,https://newsukraine.rbc.ua/news/putin-must-accept-ceasefire-with-ukraine-1764474493.html,t3_1pacv9r,AI
2025-12-08T17:16:54.830934,worldnews,Poland charges three Belarusians and two Ukrainians with espionage,334,https://notesfrompoland.com/2025/11/29/poland-charges-three-belarusians-and-two-ukrainians-with-espionage/,t3_1paccah,AI
2025-12-08T17:16:54.830934,worldnews,Russian Tu-22M3 Bombers Armed With Supersonic Missiles Buzz NATO Airspace,1979,https://united24media.com/latest-news/russian-tu-22m3-bombers-armed-with-supersonic-missiles-buzz-nato-airspace-13879,t3_1paa5s2,AI
2025-12-08T17:16:54.830934,worldnews,"/r/WorldNews Live Thread: Russian Invasion of Ukraine Day 1375, Part 1 (Thread #1522)",606,https://www.reddit.com/live/18hnzysb1elcs,t3_1pa8nrq,AI
2025-12-08T17:16:54.830934,worldnews,Hanwha Aerospace awarded L-SAM contract to enhance South Korea’s air defence network,69,https://euro-sd.com/2025/11/major-news/48022/hanwha-awarded-l-sam-contract/,t3_1pa74sm,AI
2025-12-08T17:16:54.830934,worldnews,Beijing building bases on coast: MAC - Taipei Times,219,https://www.taipeitimes.com/News/front/archives/2025/11/30/2003848062,t3_1pa36qh,AI
2025-12-08T17:16:54.830934,worldnews,South Africa declares violence against women a national disaster after mass protests,2358,https://thenewfeminist.co.uk/2025/11/south-africa-declares-violence-against-women-a-national-disaster-after-mass-protests/,t3_1pa0kog,AI
2025-12-08T17:16:54.830934,worldnews,HK man arrested for alleged sedition in relation to fatal Tai Po blaze,82,https://hongkongfp.com/2025/11/30/hong-kong-man-arrested-for-alleged-sedition-in-relation-to-fatal-tai-po-blaze,t3_1p9zq4n,AI
2025-12-08T17:16:54.830934,worldnews,"Step into the magic! ✨ Disney Dreamlight Valley is on sale, up to 30% OFF. 🏰 Build, explore, and live your dream adventure with Disney and Pixar friends. 💖 Offer valid for a limited time—don’t wait!",0,https://alb.reddit.com/cr?za=unLUNyTd4kzG0Vt_Idb1mrW2oLPWo0_nbq0-IuiLr6zxiT-e6A4pORcqS93sStE9TPWsW2q_JVkaLeiieG7pcyzxSqwgFHyO7FycPf95_6q-6hkZTqkynJpIZg_KTq6yKOG96LuLMO409wjiPb9F6nh_1uvUoOMMzsvraq8uqTqHvs4ynGMv1JxQ6ib9e_dQspSGGM5nduhDx-0J48yqULFvBb-sZnLQRnJtVD7NxbEjW9ZM7XumFj2vBA9O5HgVl0EzlvOftJw-BdM1kvOUQ2qMK9s5n0ljXCUbj4Y3i2GlVZMryrt5mjTQdy0R7VWy5HYN8XuC6ti-Mo4m-hq-i-_wQMY5AvACpHgFelTr1bs7--kfp-so9NA_PtX1caWBQe-a0qTLsqKpp4YUi-J91YkfGGnzCrsJPGen8iGeFk5SQKS6UC1F2FvfxY5StjPNdKpoAcxYJ9A4SUL4-I1ZVtMAxFGF_xxHuejOcdXBYnZJdyudmWemd-kGn92jWvyDgK5NYClX3tNftQQfqRhLgGlcshpSQrhwP6tMWLinJ5TcX_bAwxt2BBJkx4Qn6v1DacLbU52mCViGEC1n7jzihAEu5HxF4MKilL-FmMb1qvJBVZXS0sKnuaPCqS15m6t9Z2z-_zv-ux5TLL02yJQUsGak8K3KYCkQFQtqEFxiUZNi&zp=WaD73e3vSukrE-p5WNdsdDIN1ZhwcIJKV7rkeh8bQlGSJ0hlG-U-krQsabs0naZQnqhKho30_Jja8jv-tHaS1Itai5bvj8zU5BFiHnCy6ooIAChcipFg4rzlZrHl2yHHsKhjF98uYHgtuv5UhUQ8upL2lIk_HDiZ82RshmVbl5ts6f9fa3k1rx1w-QADlwH_osHFUkVtagQQSB5fVEjs4CMXtz1t_j2eFRFVWEPw7vRuf9f8MGBbG4H-YEwy_LG-9t4tgsIjwGWfPYk4CyILgGP65cT9L6bWFXxx2pRR359HchqQ5PjE_mu624rp2qUKIcN1zBwJwgENhSAZbn6oOf7QE6rZqOGoL4SvEIQR47PBYHQVygNf1CQ3F3PqEh-1WgoLFuCFjRbkQs58tACl6JN-M9qBs_b7Plg4bd3U7btnMBh7J85WP41RW0TIraPLCDu5IGtztQbYdQ1t_zO2yLdKtyXZBHHG0ig3AXJ36LMzTPKnQOxmKZ8fiGHqSgh6xYzeFCmW5zxMRENm0t2sB_8m60R5PRXN6KaV7lEbsSbpzAWbGMUCJKiQxKEFAGCqRaM-wFo5PbmtS8tlwtEgCV1zB06oyJMOZkxa1lV_7Ra90DzV3t80TMLn2vbp2MTsov7v4V8G-8kQDOM5PEpB6vYVzgmKwOfmdI6pOMhvbUrNCbm6d5EbW-3-b6LeqJ-jkh0j2m0J841FQgJnikmeasKqONF3vMl53t6gXt88kGuDdi6ZZjoJdy3hPlXVl2dl17vhVBw-lsWqtUNeVjAImdWvG4wZSJyqwcpfMJ8dUYbvz0oxKRMFl4GhLXjY8l05RQ-tnrSKWdPUp6vsNl0cgcb_6U3OLyUSdN2IHtQlULmCH5gYg-OjgiSjP7gqyy-jqiLzecW4M3q-CsbI5d7WbQdtU0AQ-BRL2AIQYtkO-HpJVhzNPC0Odyetxooe6w2Ecd-hXyB2nCwKeGAX08YcHktTOaZS--mZ3mYYtCNwoiaf5p5DZ0nEG_16alippdJhY4HCZSQhmx9nyNDAZKmRgPxP5foQSq8RE8AxHBWjk6_kH3tJRdQ6pBjjvvEXUHBBKGQ0zceRcK7CeaSctQBSQJWoBcW9qKzbrb1EDeSU5g,t3_1phdzil,AI
2025-12-08T17:16:54.830934,worldnews,Pakistan cancelled military action against Afghanistan at Qatar's request: DPM Dar,159,https://www.thehindu.com/news/international/pakistan-cancelled-military-action-against-afghanistan-at-qatars-request-dpm-dar/article70339831.ece,t3_1p9zemi,AI
2025-12-08T17:16:54.830934,worldnews,Venezuela calls Trump airspace closure warning 'colonialist threat',20152,https://www.bbc.com/news/articles/c741mpdyw9no?at_medium=RSS&at_campaign=rss,t3_1p9yuk6,AI
2025-12-08T17:16:54.830934,worldnews,Officials at Argentina-Poland Economic Forum in Buenos Aires sign memorandum of understanding with Milei government to boost cooperation and trade ties,65,https://www.batimes.com.ar/news/world/poland-sees-room-for-growth-with-perfect-match-argentina.phtml,t3_1p9wqvd,AI
2025-12-08T17:16:54.830934,worldnews,North Korean regime transforms former royal residences and civilian airports into launch platforms for intercontinental ballistic missiles while defying international scrutiny,274,https://www.dailynk.com/english/from-fairways-firepower-inside-north-korea-camouflaged-missile-program/,t3_1p9vri2,AI
2025-12-08T17:16:54.830934,worldnews,"Moldova says Russian drones entered its airspace again, posing aviation threat",1504,https://www.reuters.com/world/moldova-says-russian-drones-entered-its-airspace-again-posing-aviation-threat-2025-11-29/,t3_1p9usm5,AI
2025-12-08T17:16:54.830934,worldnews,Hong Kong man arrested for alleged sedition in relation to fatal Tai Po blaze,786,https://hongkongfp.com/2025/11/30/hong-kong-man-arrested-for-alleged-sedition-in-relation-to-fatal-tai-po-blaze/,t3_1p9tr4e,AI
2025-12-08T17:16:56.825728,worldnews,"Russian strikes cause power outages for more than 600,000 in Ukraine",977,https://www.bbc.co.uk/news/articles/cx2gylngx7go,t3_1p9r9mo,AI
2025-12-08T17:16:56.825728,worldnews,Mass protests in the central German town of Giessen against new AfD youth group,2840,https://www.euronews.com/2025/11/29/mass-protests-in-the-central-german-town-of-giessen-against-new-afd-youth-group,t3_1p9p9eo,AI
2025-12-08T17:16:56.825728,worldnews,Ukraine says it hit Russian ‘shadow fleet’ tankers with underwater drones in Black Sea,8198,https://www.cnn.com/2025/11/29/europe/russia-shadow-fleet-ukraine-explosions-intl?utm_medium=social&utm_campaign=missions&utm_source=reddit,t3_1p9p616,AI
2025-12-08T17:16:56.825728,worldnews,Trump says airspace above and surrounding Venezuela to be closed in its entirety,20390,https://www.reuters.com/world/americas/trump-says-airspace-above-surrounding-venezuela-be-closed-its-entirety-2025-11-29/,t3_1p9oko8,AI
2025-12-08T17:16:56.825728,worldnews,Thousands of Airbus planes grounded after faulty software detected,129,https://www.euronews.com/2025/11/29/travel-disruption-thousands-of-airbus-planes-grounded-after-faulty-software-detected,t3_1p9o8vt,AI
2025-12-08T17:16:56.825728,worldnews,Indonesia and Thailand flooding death toll tops 350 as rescuers struggle to reach worst-hit areas,102,https://www.theguardian.com/world/2025/nov/29/indonesia-and-thailand-flooding-death-toll-tops-350-as-rescuers-struggle-to-reach-worst-hit-areas,t3_1p9lyz1,AI
2025-12-08T17:16:56.825728,worldnews,Verified Russian Deaths in Ukraine War Surpass 150K – Independent Tally - The Moscow Times,3575,https://www.themoscowtimes.com/2025/11/29/verified-russian-deaths-in-ukraine-war-surpass-150k-independent-tally-a91279,t3_1p9kjz8,AI
2025-12-08T17:16:56.825728,worldnews,Russia-Ukraine war: Drone strike hits Kyiv residential areas despite peace moves,205,https://www.bbc.com/news/articles/cx2gylngx7go,t3_1p9gbmq,AI
2025-12-08T17:16:56.825728,worldnews,"/r/WorldNews Live Thread: Russian Invasion of Ukraine Day 1374, Part 1 (Thread #1521)",589,https://www.reddit.com/live/18hnzysb1elcs,t3_1p9f4tm,AI
2025-12-08T17:16:59.688233,worldnews,Delayed Manx-owned ferry terminal berth repairs now complete,27,https://www.bbc.com/news/articles/c20gkny9kppo,t3_1p9dtgt,AI
2025-12-08T17:16:59.688233,worldnews,Flights disrupted as Airbus requests software modifications to thousands of aircraft,626,https://www.bbc.com/news/articles/c8e9d13x2z7o,t3_1p94q5b,AI
2025-12-08T17:16:59.688233,worldnews,Purple Plume Over Russian Test Site After Suspected Sarmat ICBM Launch Failure,4938,https://united24media.com/latest-news/purple-plume-over-yasny-after-suspected-rs-28-launch-failure-13868,t3_1p91p04,AI
2025-12-08T17:16:59.688233,worldnews,Belgium’s De Wever adds “peace deal” argument to block €140 billion Ukraine loan,96,https://euromaidanpress.com/2025/11/28/belgium-de-wever-140-billion-ukraine-loan-frozen-assets/,t3_1p8ztai,AI
2025-12-08T17:16:59.688233,worldnews,Zelensky's chief of staff Andriy Yermak resigns after anti-corruption raid,2787,https://www.bbc.com/news/articles/ckg9nd2wddno,t3_1p8yrfg,AI
2025-12-08T17:16:59.688233,worldnews,Zelenskyy's chief of staff resigns as Ukraine corruption investigations widen,287,https://apnews.com/article/russia-ukraine-war-yermak-corruption-3a58193bcb3f7816a715dee9e60e4541,t3_1p8y6co,AI
2025-12-08T17:17:01.562116,worldnews,Hong Kong's deadliest fire in decades followed a year of safety complaints,55,https://www.reuters.com/world/china/hong-kongs-deadliest-fire-decades-followed-year-safety-complaints-2025-11-28,t3_1p8wxh3,AI
2025-12-08T17:17:01.562116,worldnews,Hungary's Orban defies EU partners and meets Putin again in Moscow,256,https://www.bbc.com/news/articles/c058lny3pdqo,t3_1p8wsrt,AI
2025-12-08T17:17:01.562116,worldnews,"Poland detains two Ukrainians, three Belarusians suspected of spying",88,https://www.reuters.com/world/poland-detains-two-ukrainians-three-belarusians-suspected-spying-2025-11-28/,t3_1p8wri0,AI
2025-12-08T17:17:01.562116,worldnews,"'If you give your life, you live forever' — North Korean soldiers in Ukraine encouraged to use grenades to avoid capture, media reports",831,https://kyivindependent.com/north-korean-soldiers-in-ukraine-encouraged-to-use-grenades-to-avoid-capture/,t3_1p8wh1g,AI
2025-12-08T17:17:01.562116,worldnews,"Belgian PM raises stakes on Kyiv lifeline, renewing opposition to Russian frozen-assets reparations loan",55,https://kyivindependent.com/belgian-pm-raises-stakes-on-kyiv-lifeline-renewing-opposition-to-russian-frozen-assets-reparations-loan/,t3_1p8vmz8,AI
2025-12-08T17:17:01.562116,worldnews,Dragoș Buzzi returnează din greșeală sticla copilului și încearcă să o prindă din urmă înainte să ajungă la RetuRO.,0,https://alb.reddit.com/cr?za=ekAaw0Z-yAszLc4W_SiSJz5Ufxi-2K5OH0aXI-NVYSKtuLsvWdvjm4rm_EHdnnAyWCwac_IzxzL-6VyLjEj_SxLRTPEmkZWjTvFIRtntlarA_aiOTt1-66WI67NRX7dDAIqA0RWqvIx-f23mBef4ByiVps7YTFeRW_JBWL2EY2A6jb3k-nMIBP6US1sYFdGgseBpTkB0t190WLgTFprTkL-akJDaUPLyAs53RpBIj4cdnVORYX6pk_cdelDEH-LSMoG8gV5baE18X-4n9nNN6IxDf7pneG3-gzNJiBYKYAIggAgI_Zm4tgNsQTY-qsNWTVqKmf9P2Ybo0x1rhCBEClnm0lSLI9MMXOB4JwW2e4FRnSsBgT5nfiAkzOD6uJKjwwYP1R27wCnikwDFsw5OLZ_S0KeR-xnnLQDJG6AeL_9XgN0FHRsWi84YIaH_H1w9hXhHoANVelKVeus11WERM5_mWa9tRK3H4l6ALQ8_1H7oeD-Nofpl-xswINL66OzcdH1dlU--K8H3Q6ecGLRpUUsuI3oEt6M3sMqOXnaQBmgnnWX4n7SX4MwceNVhBbWYdKYJxr-IC5voW4r718aeiDPOpNIPGTrdeAfoJ56-bHcF-MU1bztTjifi1USlX9j6kxrq7bvcfWtTvGk6XszZSQoZX_oQfx-i5CGxX_T8WwKPGbmCOG2A-26tfggm4m2TWTsvgRgpjbbuAFlwbiP40-5OIG9M0TIeFk9FvGht3YDnuGkz0H9JAQ0UdieBT9P4SsW9QYu8vyMWI3Fc9uBMTBYr3VuBe8BqP-6C3KYXccitopkajAxNfY7pGnusT6mUwivmjFtucvSqGSCaARTukA4xArLkiFeE3rZSf5IhbJMMjsOOUVcuA0_ugnNNy3WwHBVpMugVMQ&zp=gOxyDBfM8-wt-10QfAB0E6OA62COtJVR4gYwuU6orZURZTSEL-uW2wk8q5oc8a260HyieFZrnVid__3l4py5CQcfdBsCENb4ZfwV-6lshDSm0k83FlyEQ1F48Xfy3IlCn6aeOV5I6HVpvau2vB7XJIP7wGPl4PpjoZlP7dZNjcweo2S1VQGFD5wuPA_VocwzlG9l5CmiW_AIOxyC3ETzjywgHlAa2KTneoNY5NSyrX6C7s-lks1NOs5ia60XqExpN7bniHb0BH_Wnm7Nde3OT05fx7mMi7Vbb7-dt3q6GXvM6ooCBSJJkAjppoD3QJN6Xd5q5VmJkMp9iqE2L7uGutTnfH2fOv5uQw,t3_1owprlx,AI
2025-12-08T17:17:01.562116,worldnews,Telegraph: Trump prepares to recognise Russia's occupied territories in Ukraine,24316,https://en.protothema.gr/2025/11/28/telegraph-trump-prepares-to-recognise-russias-occupied-territories-in-ukraine/,t3_1p8vbht,AI
2025-12-08T17:17:01.562116,worldnews,UK Fails to Reach Deal to Access EU Defence Scheme,88,https://www.kyivpost.com/post/65195,t3_1p8ueow,AI
2025-12-08T17:17:01.562116,worldnews,Belgium hits back at EU plan to use frozen Russian assets to aid Ukraine | Belgium,89,https://www.theguardian.com/world/2025/nov/28/belgium-hits-back-at-eu-plan-to-use-frozen-russian-assets-to-aid-ukraine,t3_1p8ubkf,AI
2025-12-08T17:17:01.562116,worldnews,Ukrainian anti-graft police search home of Zelenskiy's top aide,59,https://www.reuters.com/world/europe/ukraine-anti-corruption-officers-search-office-zelenskiys-chief-staff-officials-2025-11-28/,t3_1p8t8ig,AI
2025-12-08T17:17:01.562116,worldnews,Explosions reported in several Russian cities amid Ukrainian drone attack,1435,https://kyivindependent.com/explosions-reported-in-russian-cities-amid-ukrainian-drone-attack/,t3_1p8see1,AI
2025-12-08T17:17:04.298364,worldnews,Belgium PM says using frozen Russian assets could derail Ukraine peace deal,1,https://www.reuters.com/business/finance/belgium-pm-says-using-frozen-russian-assets-could-derail-ukraine-peace-deal-2025-11-28/?link_source=ta_bluesky_link&taid=69297adfe171010001f8d478&utm_campaign=trueanthem&utm_medium=social&utm_source=bluesky,t3_1p8s218,AI
2025-12-08T17:17:04.298364,worldnews,"Ten people killed during Israeli raid in southern Syria, Syrian state media reports",10,https://www.reuters.com/world/middle-east/israel-detains-islamic-jemaah-suspects-syria-israeli-military-says-2025-11-28/,t3_1p8rrjk,AI
2025-12-08T17:17:04.298364,worldnews,Kim Jong Un Orders North Korean Troops in Ukraine to Self-Detonate Rather Than Surrender,6296,https://united24media.com/latest-news/kim-jong-un-orders-north-korean-troops-in-ukraine-to-self-detonate-rather-than-surrender-13837,t3_1p8rqe7,AI
2025-12-08T17:17:04.298364,worldnews,Trump says US land action against alleged drug trafficking networks in Venezuela will start ‘very soon’ | CNN Politics,429,https://www.cnn.com/2025/11/27/politics/trump-says-us-land-action-in-venezuela-very-soon,t3_1p8qxiu,AI
2025-12-08T17:17:04.298364,worldnews,Putin doubles down on demands for Ukrainian territory ahead of talks with US,69,https://www.bbc.com/news/articles/cp84nl57v0lo?at_medium=RSS&at_campaign=rss,t3_1p8pkns,AI
2025-12-08T17:17:04.298364,worldnews,Anti-corruption investigators raid Zelenskyy’s chief of staff Yermak,418,https://www.euronews.com/2025/11/28/anti-corruption-investigators-raid-zelenskyys-chief-of-staff-yermak,t3_1p8paij,AI
2025-12-08T17:17:04.298364,worldnews,"Taiwanese authorities raid Intel exec’s home, seize his computers",175,https://www.oregonlive.com/silicon-forest/2025/11/taiwanese-authorities-raid-intel-execs-home-seize-his-computers.html,t3_1p8p819,AI
2025-12-08T17:17:04.298364,worldnews,Searches being conducted at office of Zelenskyy's top aide Yermak,168,https://www.pravda.com.ua/eng/news/2025/11/28/8009349/,t3_1p8osts,AI
2025-12-08T17:17:04.298364,worldnews,UK rejects visa for girl left destitute in Jamaica by Hurricane Melissa,0,https://www.theguardian.com/politics/2025/nov/28/uk-home-office-rejects-visa-young-girl-destitute-jamaica-hurricane-melissa,t3_1p8oldj,AI
2025-12-08T17:17:04.298364,worldnews,Ukraine will not give up territory while Zelenskyy leads: Yermak,2489,https://www.trtworld.com/article/c8e4584bfdf0,t3_1p8mjxf,AI
2025-12-08T17:17:04.298364,worldnews,"/r/WorldNews Live Thread: Russian Invasion of Ukraine Day 1373, Part 1 (Thread #1520)",528,https://www.reddit.com/live/18hnzysb1elcs,t3_1p8l92b,AI
2025-12-08T17:17:06.789234,worldnews,Report: Iran sent hundreds of millions of dollars to Hezbollah through Dubai businesses,672,https://www.ynetnews.com/article/sjbm00e81111e,t3_1p8h6dt,AI
2025-12-08T17:17:06.789234,worldnews,Putin insists Ukraine has to surrender territory for any deal to be possible,761,https://www.theguardian.com/world/2025/nov/27/putin-insists-ukraine-surrender-territory-for-peace-deal-possible,t3_1p8ejbi,AI
2025-12-08T17:17:06.789234,worldnews,Britain becomes world’s largest economy to end new oil and gas exploration,1523,https://www.greenpeace.org.uk/news/britain-ends-new-fossil-fuel-exploration/,t3_1p8dke9,AI
2025-12-08T17:17:06.789234,worldnews,Hong Kong contractor for fire-hit Tai Po project has record of safety offenses: Prestige Construction fined twice for offenses in Mid-Levels project in 2023 before taking on renovation work in Tai Po,64,https://www.scmp.com/news/hong-kong/society/article/3334408/hong-kong-contractor-fire-hit-tai-po-project-has-record-safety-offences?module=top_story&pgtype=homepage,t3_1p8dfmx,AI
2025-12-08T17:17:06.789234,worldnews,Putin confuses Ukrainian cities and invents battles in Komsomolsk,2275,https://newsukraine.rbc.ua/news/putin-confuses-ukrainian-cities-and-invents-1764260993.html,t3_1p8b3ut,AI
2025-12-08T17:17:06.789234,worldnews,"Russia ready to 'fight to the last Ukrainian,' Putin says amid US peace drive",7643,https://abcnews.go.com/International/russia-ready-fight-ukrainian-putin-amid-us-peace/story?id=127927423,t3_1p8a7xl,AI
2025-12-08T17:17:06.789234,worldnews,Japan denies Trump advised Takaichi not to provoke China over Taiwan,168,https://www3.nhk.or.jp/nhkworld/en/news/20251127_13/,t3_1p8a7ov,AI
2025-12-08T17:17:09.925036,worldnews,Putin says US plan could be ‘basis’ of a Ukraine deal but threatens to take land by force if Kyiv doesn’t withdraw,1486,https://www.cnn.com/2025/11/27/europe/putin-trump-ukraine-peace-intl,t3_1p89jk7,AI
2025-12-08T17:17:09.925036,worldnews,"Russia has 'no say' over whether Ukraine can join NATO, Rutte says",25728,https://kyivindependent.com/russia-has-no-say-over-whether-ukraine-can-join-nato-rutte-says/,t3_1p89c9t,AI
2025-12-08T17:17:09.931619,worldnews,Canada’s trade resilience faces uncertainty as CUSMA renegotiation looms,13,https://nationalpost.com/news/canadas-trade-resilience-faces-uncertainty-as-cusma-renegotiation-looms,t3_1p88b7t,AI
2025-12-08T17:17:09.931619,worldnews,Hundreds of Israeli soldiers raid Palestinian town in West Bank,15,https://www.theguardian.com/world/2025/nov/26/hundreds-israeli-soldiers-raid-palestinian-town-tubas-west-bank,t3_1p87w1v,AI
2025-12-08T17:17:09.931619,worldnews,Germany's Merz: Ukraine will need strong army after any peace deal,770,https://www.reuters.com/world/europe/germanys-merz-ukraine-will-need-strong-army-after-any-peace-deal-2025-11-27/,t3_1p87iz1,AI
2025-12-08T17:17:09.931619,worldnews,Chio La Cuptor! Coapte nu prajite! Cu 70% mai putine grasimi,0,https://alb.reddit.com/cr?za=k3dN8Lzzg1Pgu4PezDgynulMfEbYAVBhbKOnc8hRf5CRbrtsAv0A2q1FC1UD4F6aEkzTmJ1EtsoxZyUVp6xLy3IFCgiLEs-qTN66JL_bkYM66exn-Oucu9m4esbalrjJ3iqiQH5AP_ReVoroyj3_Pr-r3Er3XMkM6b8nFpo7hwm1Lr5uDV-gqQEnYR7-IhFqRIlDbrMRBWbxTkgzjHouO0xb1tTDLsGH-rD--zYDPLrjCcfmMWEHxqykr2jRixEIMFTiBwbtZ8dWVW5PlQqV9ajet62MYG9uDE10WsBGUrnPFIYQCytCyHN7dATAlBtQO97ZH4wiCOWc1_WCJWNjXKdTeC8dbP2vb6BM0wp3ayBfSGWJJcJCHZQNE9TKTZxCGUZAxQYDOxAdga2iBQa93sDP1gnHVZjKFlYxBTwcAcM9mWEu_rgNIImLyFGrYiXt-zKN-zIrmPrJ2R74WNytny07G-WlCrWCgfcwS59VUuOGQ_ays0moSFMf-0bt8QBNcXAnJR2rZ7MPZOgISQzAmQltAhdxQDc7O_OLMFxORJYDrISFEG9vQhPgO90mUaeJzVptZK7iL4qcoY3rHkNqJpUrRSFyO0NZYVBetuOD3jbHsBlz&zp=inNg-nq_rfz6PByLmn7LrY4QbtQRyPOyRISSTbJee_eJz9R1KBeVv3snd4JSPhD13g21g8anmV_k1UjFm55R7QlRLaPi9BC5A0DU0z-qF3U6-9_qaIhmjws-Pr3JDtu5gx5dBOEsgipPL6e2o7H9DmtrmAyCKgAlxuLZlyz9OlysAg31MzvMiLEl1D6hdjvc54T9dwLUCt5a_SS2zA_UtUl3VyU6eweqR42qtK2Lty3XBhbEZT2RL1FRrqv7ON5ATYrJM-E3G28p-mN6bAdsONtEJru3Dpuc22aUEXNyRC71MLsgakAji2WRYYg0nMlL86N01CpzcLdxIj7jxEC3D8rKg9QdfJgMEC2qdaUaXq2bgdKkuyUJkd738m3UB1ZETx6jNrfamF0De5y1PhEqSsKItq3ZwIq-vQhuf6GKOc_TMEuuxe8Fq24AbeM2H8BqOWBOXzXyc6Adwl18K3Xno5dnt3q0N5Ik79QVoA8NUKeRJsUo,t3_1pe39zl,AI
